,date,userName,review,title,rating,isEdited,developerResponse,Company_name
35,2020-07-24 23:56:52,sarbear10101,"I’m floored this app has such a high rating.  I find it very cumbersome to use.  Today when double checking to make sure I chose the “toasted” option it takes you through customizing and then the “add to bag” comes up again.  So I needlessly doubled my order and received 4 foot-longs instead of 2.  None of those darn things are toasted either.

Secondly, the stores I frequent are poorly run.  I’ve had numerous occasions where they’re out of guacamole and then look at me like I’m from outer space if I ask if they reimbursed me for the extra charge.  Today I got to the car and realized they sent me without any napkins.  They didn’t see my special request to put the meatballs on the side of the meatball sub because- kids- and there’s no option to just custom order a sub with pizza sauce, pepperoni and olives.

It’s all so frustrating I had given it up completely then came back thinking it would speed up our road trip.  Now I have a mess of 2 extra sandwiches, no napkins, loose meatballs and a crabby family all around.  Not to mention I bought more sandwiches than I care to transport or eat.  I won’t be back.",Horrible every time,1,False,,Subway
36,2020-05-16 01:02:41,subway fanatic lovet,Ok I have to give them credit for replacing my order although i wish they’d dress my sandwiches like they did the second time cause that was perfectly correct it reminded me oh how subway first ever had me hooked the taste of all the explosions of the veggies and sauces was spot on I like banana peppers lettuce tomatoes olives mayo and honey mustard in every bite and their willingness to go beyond and make it right I am glad about as well the app was ok as well I liked how you can customize it how you want it althgh for future reference please consider 2x as a good amount then you’ll never go wrong  cause commonly extra or double 2x amount doesn’t seem to be double but normal amount . But I am happy but i hope I don’t have to give a bad review or complain to get an order correct in future . Thanks for making it right guys .i was very satisfied with my 2nd replacement order.,2nd Order was made right !!!,5,False,,Subway
37,2019-11-23 11:45:39,Lou BP,"The Subway app has updated and changed for the worse. First is that the app makes it ridiculously difficult to select or change the store your ordering from. Sometimes even refusing to do so after you select the store you want, and given the no refund policy it can hurt having the sandwich  you payed for in the wrong place. Second the app constantly runs into errors having once completely ignore my order, after I had ordered it and everything. 
Lastly the app charged me TWICE for one sandwich. The app order history says one sandwich, when I picked it up I had one sandwich, but my transaction history on my bank account has two separate identical charges for the sandwich. I am currently trying to see if this can be resolved but be warned.
With the above said there are more rough unintuitive parts of the app like accessing your cart or editing it bar those problems don’t bring actual consequences like misplaced, unplaced, or double charge orders like the other problems.
Before the update the app didn’t have these frustrating problems but now I just say, call the store ahead instead and save yourself the trouble.","Broken, Buggy, and just plain Bad",1,False,"{'id': 12777066, 'body': ""We appreciate you sharing your feedback, and are always looking for ways to enhance the mobile app experience for our guests. You can always reach out to us by tapping 'Contact Us' in the Menu, or at (833)-778-2929.\r\n"", 'modified': '2020-01-07T18:05:55Z'}",Subway
38,2021-09-16 16:33:24,abccchrs,"Worst food app ever I think. It keeps clearing the cart. You have maybe 3 minutes to complete the order or you have to start over. If you manage to get an order placed you then find That it was a waste of time because regardless of what is entered into the app you will be picking up what the sandwich maker wishes to prepare rather than what you ordered and then you will be told that is your fault. You have to step them through making the sandwich. They have an aversion to not toasting a sub. I ordered 4 subs, none toasted as that is an option in the app. 3 of the 4 sandwiches were toasted and the one that was not was in the same bag steaming and getting soggy. They actually told me they always toast the subs and threw their hands up when I insisted that I ordered exactly what i wanted - app has choice of toasted or not, and I ordered not toasted, but that seems wrong to them. Lol. Meat on about half the footlong had to be spread out. Just awful. You have to actually direct every step or they will just throw it together with whatever toppings they choose. Or better yet save time and go somewhere else.",Good idea doesn’t work,1,False,,Subway
39,2017-10-11 15:10:22,ThatGuyInCharlotte,"EDIT:  the app does now allow me to order a sandwich.  So that’s an improvement.  Everything else below is still bad though.  Added one star back. 

Favorites are impossible to manage and weirdly include the restaurant so you need multiple favorites for the same sandwich if you live and work  in two different places or if you are traveling, you can’t use your favorites.  Selection of location is cryptic and often results in being stuck unable to add food to purchase.  Can’t change restaurant after picking food.  Why can’t I choose to use my points as a payment method?!   This update has actually made it impossible to order anything.  Error every single time I have tried the last couple days.  So many opportunities to do better it’s impossible to list them all.  Whoever you all got to rewrite this a few months ago should be fired and possibly subjected to the game of thrones walk of shame.  Worst implementation of a simple storefront I can imagine.  Seriously, I just want to order a sammich and have it ready when I arrive.  The app used to do that amazingly well.",Terrible,2,False,"{'id': 1474100, 'body': 'Hi there. Many features- including an improved restaurant locator, redeeming offers and rewards, and the ability to save favorites not associated with locations- are being implemented in a future releases. If you are ever experiencing errors, general technical problems or problems related to your orders at a location- please contact our support team at appfeedback@subway.com, or by calling (800)-888-4848. Thank You!', 'modified': '2017-10-11T15:57:53Z'}",Subway
40,2017-11-20 16:24:50,dhaynes381,"This app went from buggy to completely non-functional. Open the app and after a few taps it crashes and closes. I’m not going to spend any time detailing the exact issues I’m experiencing because the Subway response will be the same copy and paste response they have given to everyone... “We want to help, please contact us at.... yada, yada, yada...”. Bottom line is, the app doesn’t work for most people and needs a drastic overhaul by competent developers. So far all that Subway has had to offer is copy and paste lip service. Make a meaningful effort to your customers and admit that the app is broken and that you’re actually addressing the problem with qualified developers (assuming that’s what you’re actually doing). There are more complicated apps out there that perform flawlessly, so yours doesn’t have to be an exception - hire qualified people Subway.",Simply Doesn’t Work - Subway Gives Copy And Paste Responses,5,False,"{'id': 1858334, 'body': 'Hi there- we are here to help! Because there are no known issues at this time, please contact our support team at (800)-888-4848, or by email at appfeedback@subway.com. Have your app version, device type, and the steps to reproduce any errors ready- so we can investigate and address these concerns for you. Thank You!', 'modified': '2017-11-27T14:43:35Z'}",Subway
41,2020-08-19 15:49:52,All Names Are Taken 123,"For some unknown reason this thing changed my order time to 3:35 PM when I’m trying to order lunch at 11:30 AM. Then it charged me. I had no idea it had set it for four hours later, until I went back to see when my order was going to be ready. If you go to try to cancel the order in the app it just gives you a number to call the restaurant location. The restaurant location told me they couldn’t even see the order until it was 15 minutes before the time. So there is no way to cancel this order, unless I sit and wait around to cancel it at approximately 3:20 PM. Well, I have a job to do, and I don’t have time to be thinking about canceling this order in their magic window. 

I’ll just go to Hardee’s. You’ve got $8.55 out of me, Subway, and I’m deleting your app. And I won’t go stand in line, so I guess I’m done with SUBWAY®. If I can order through the app four hours ahead of time I should be able to cancel the order in the app four hours ahead of time, or at least cancel it through the restaurant without having to be scheduling a call in a magic window.","Ripped Off, Deleting App",1,False,,Subway
42,2020-08-03 02:19:58,stay young have fun,"There is a limit of six for each order, so I had to have two orders. This app is not updated with locations that have advertised deals so calling each location before you order. Plus the new sandwiches are not updated which means maybe you won’t want BBQ on a BBQ sandwich. Due to training every location makes condiment sandwiches even if you request “little” or “light” sauces. On my second order I received two of the of one sandwiches and clearly made the order not this way. Disappointed after getting home then traveling back to the location to get my money back for just the wrong sandwich I was told NO. They could not refund just one sandwich and told me I possibly could go through something online. There is nothing on the app for this option. The only refund is for the whole order, at location, and then repurchase the sandwiches that were made correct. Thanks for the lesson in total $60 for two orders and not what I ordered. I won’t use app or order at locations again.",First time used is now the last!,2,False,,Subway
43,2018-04-15 21:44:15,DavidOrta,"Today I spent $24 dollars for an $8 order. I use food apps all the time and this app is by far the worst at picking up my location...I only order in two locations and every single time it picks the wrong location...other apps see where I am and what locations I most commonly use and when I place the order it’s always in the right location...today I had an order go to an Anaheim location, and San Pedro location (West St). The problem is I wanted the order to go to the San Pedro location on Western (which is the only San Pedro location I ever visit). I have never visited the one on West. I even tried to cancel the order and the person on the phone said they didn’t know how this could be done and unfortunately they could refund me...long story short two locations today got $8 from me and I am not picking up the food. Spent $24 today and I only wanted to spend $8. This app by far has the worst location intuition of any food app I have ever used. Thanks Subway for the fun day! My recommendation for anyone using this app is to diligently check the location even if you go to the same location every single time!",Worst location intuition app,1,False,"{'id': 3164132, 'body': 'Hi there- so sorry for the inconvenience. Please share more details with us at (833)-778-2929 or appfeedback@subway.com- so we can make this right. Please mention or have ready the restaurant location, date/time you placed the order, and your user name when contacting us. Thank You.', 'modified': '2018-04-17T19:03:22Z'}",Subway
44,2020-06-06 20:23:18,RaydeeRoweee,The woman at the subway I go to is horrid. I thought it was only me until a guy came to pick up an order and told her have a nice day and she ignored him. Then she treated my husband the same way. Everytime I go in I wait 20 mins for her to acknowledge me or if she does she will say “hold on I’m doing online orders” she was nice my 2nd time ever going in because I left her a 15$ tip my first time even tho she was terrible thinking maybe she is having a hard day maybe she had a death in the family. So the next time she was polite to me but that was the day she didn’t even acknowledge the other customer or tell him to have a nice day. That woman should not have a job in customer service but that is neither here nor there thank you to whoever made this app and saved me from spending another min with this wretched woman!!,Save me from the evil lady at Western Lights plaza,5,False,,Subway
45,2020-06-20 21:57:18,Slfoshee,"I agree with gentlemen’s comment from two years ago.  The app may work sometimes all the way through the order and customizing your sandwich.  When it came time to pay, I found my current default payment information had expired.  There is no way to edit your default payment with new expiration date and cvv so I was forced to re-enter all my payment information again and save as default payment.  After hitting “place my order” again I received a strange error message “Uh-Oh, error on property ‘update’ and on undefined.”  Have no idea what this meant as I tried to enter the payment information four times with same error after hitting place my order.  After four attempts I had to use the old fashion way of calling it in giving my order over the phone.  Apps are supposed to make it easier and more efficient not cause you to waste your time.  There is no way to contact developers thru the app except coming back to App Store to leave a review as your website wastes your time again giving no way to submit issues.  Pretty sad!",Does not accept payment,1,False,,Subway
46,2020-06-16 19:43:41,Queen Endermen,"Our order was not processed on time. The app said it was ready for pickup. The app was wrong. The store had not even begun to process or make the order when we arrived. 

We had to leave because we could not wait any longer. The employee was fixing customers sandwiches who had just walked in the store instead of fixing our online order that had been placed over 20 minutes before. 

For a refund, we were told by the employee that they could not refund our money and that we had to call customer service. But the employee did not have the customer service number. 

There is also no way to request a refund on the app or anything to troubleshoot should an order go unfulfilled. 

When we finally found a number using Google (because the Subway website does not list a number), we got an automated message saying that app order issues can only be handled by sending a message through the website. Which is ridiculous. 

Perhaps a troubleshooting tab on the app. Or a way to request a refund through the app. Anything but having to go to your website and click through to find the right form. 

We did submit an inquiry on the website. Five days later, no response. And certainly no refund. 

An overall horrible experience. We just wanted food on time. Or perhaps an easy way to get our money back when the store failed to get the order ready on time. The app, the website, and any resemblance of customer service from Subway all failed.",Works Great If Order Is Correct - Good Luck If Not,1,False,,Subway
47,2019-12-14 01:45:18,Leti Jo,"I’ve previously tried to have my barcode scanned in the store to earn points only to be told either the scanner doesn’t want to scan it, doesn’t work, or some other reason. Today was the first day I made an order on the app and went to pick it up. Not only was my husband’s order wrong but the female employee was not even trying to see my phone to verify that my order did indeed include a 3rd FREE footlong sub. I mean...absolutely REFUSED to look and even MAKE the sub! It was paid for ahead and everything. The other employee there did look at my phone and verified that there was in fact a 3rd sandwich in my order but ended up having to pay for it out of pocket himself?!?! He shouldn’t have had to have done that for my order to be made as the promotion was for Buy 2 footlongs and get 1 footlong free. The woman who refused to look at my phone then said that I shouldn’t place the order online anymore and just show them the offer in the store. I don’t know what the heck is going on but this app is more of a hassle than anything for the few times I’ve actually tried to use it.",Always have problems in the store,1,False,"{'id': 12775794, 'body': 'We apologize for any inconvenience this caused. Please contact us by tapping ""Contact Us"" in the app menu, at (833)-778-2929 or by email at appfeedback@subway.com- so that we can make this right! Please mention your concerns, the restaurant location, and your user name while contacting us. We look forward to hearing from you. \r\n', 'modified': '2020-01-07T16:42:35Z'}",Subway
48,2021-10-10 01:57:40,Syracuse R,"This review involves the remote ordering and delivery on the app. The process is very poorly designed. I expected that the app would be like ordering at a Subway shop but it is not. You cannot order things on the app like you can in a store - they restrict the available vegetable toppings and actually don’t allow you to add certain topping that you can normally just choose and point too. Secondly it’s a very limited choice of condiments. No Chipotle or Sriracha. No Ranch?!? Seriously. Items normally available at the store (like the toppings and chips that I know were at that Subway) were not available. Also at payment time it crashed and told me my payment didn’t go through, and I would have to clear the cart and start over, but it still charged my card. And the order did go through. But if I had redone it as the app said, I would have had 2 meals...Very disappointed in the app and it’s lack of selection to be able to create the sandwich I want. That’s exactly why I appreciate Subway. Don’t like the app at all.",App needs work - NOT like ordering at a Subway shop,1,False,,Subway
49,2021-02-26 20:26:06,CMitchell95,"Although the experience of pushing a few buttons and in a matter of minutes enjoying a good sandwich is incredible, I must review this app relative to other companies achieving the same functionality. This app is clunky and full of disruptive popup ads. It frequently gives errors and long load times. The favorites function is unusable. Also, don’t add a gift card to your payments because if it isn’t enough to cover the tab it doesn’t allow you to use an additional payment option to finish the order. So, if your gift card is worth $10 but your order is $11, you can’t use your gift card at all. A waste. Also, you don’t get notified about any progress of your order through the app. You’ll get an email when your order has started to be made. Emails aren’t instant so it’s often that you’ll never know when your order is ready. Hope this helps both Subway developers and customers.","Good potential, poor implementation in a time that’s needs this function.",2,False,,Subway
50,2019-08-01 05:19:03,Oriana fish,"Update: I tried to edit this right away when I realized it was a user error (aka my fault!) but apparently the edit didn’t save since I just received a response. The type if sandwich I was selecting was on...a ciabatta bun? Or something and apparently only came in the 6 inch option. It was not an issue with the app! Sorry! 

So I went to order subway which I’ve done several times without issue. This time it made me update before ordering. My son wants a 6 inch sub—it took me a minute to figure out where the 6 inch option was as I had to remove my sandwich and start over (it wouldn’t let me edit the size after I started customization). Anyway so I got it in the bag but then when I went to make my sandwich, the foot long option was completely gone. I tried a few different things, closed the app and restarted it and still, it won’t let me make a footling sandwich. I am pregnant and hungry and aughhhh! Haha please fix.",Please fix,4,True,"{'id': 9947129, 'body': ""Hi there, please contact our support team by tapping 'Contact Us' in the Menu, at (833)-778-2929, or by email at appfeedback@subway.com. Have your app version, device type, and the steps to reproduce any errors ready- so we can investigate and address these concerns for you. Thank You!\r\n"", 'modified': '2019-08-01T05:19:03Z'}",Subway
51,2020-06-04 05:33:13,lexi lee rae,When i tried to make an account and half of the keyboard was cut off and it was also at the top of my screen. Went to safari to make an account because i thought “small bug for creating accounts” but no it’s the same for signing in. I’m deleting the app and seeing if anything changes in a month. I also really only got the app so i can count my calories because the website on safari wouldn't let me build a sandwich due to it being midnight and they’re closed. But i thought to myself that the app will probably let you order ahead and it doesn't. It also doesn't let you order as a guest. 1/5 stars because you tried and i’m sure its hard to keep up an app but you're a big company you should do better for customers and your employees. I say employees as well because i read a review that its been hard for stores to get orders from online/from the app. Maybe take those options away for a while and figure out how to make it better for your employees? Apps are very convenient but not when they aren't working.,Not letting me sign in,1,False,,Subway
52,2019-12-14 21:59:23,Kelanix,"I downloaded the app because the regular online ordering failed miserably. And it was even worse. It took me 10 minutes to find the fine print to add/customize normal toppings. Next, the site kept telling me my local store was closed, when a phone call verified it was very much open. Next, after that ordeal,  despite trying three(!!) methods of payment, every one failed, returned a random error and then I’d get logged out, forcing me to log back in and do it all over again. Same problems each time. Lastly, all the hmHelp or Contact Us links threw up a 404 Not Found error.  Wonderful. 

So I download the app. At least this one shows my local store as open, but while attempting to build a sandwich, I notice that if you try to add multiple toppings from a category (i.e. cheese), it removes the one you’ve already selected.  So if you want cheddar and swiss on that sub, you’re apparently out of luck. I gave up after this. So who knows whether the app would have had the same payment glitch. I won’t be finding out anytime soon. Tonight just became pizza night. 

It’s 2019, guys. Fix your tech.",Awful experience,1,False,"{'id': 12775730, 'body': ""Hi, there. We are sorry to hear that this has been your experience. You can contact our support team by tapping 'Contact Us' in the Menu or at (833)-778-2929. If you can, have your app version, device type, and steps to reproduce any errors ready- so we can investigate and address these concerns for you. Thank You!\r\n"", 'modified': '2020-01-07T16:38:22Z'}",Subway
53,2021-12-09 17:46:12,Cassie Lesinski,"So I ordered my sub off of the app to be delivered, when I clicked finish and pay the sun hadn’t saved what I wanted done to the sun so it just added all the sides of lettuce, spinach, tomatoes, etc, it wasn’t the same bread I picked, it wasn’t toasted or had the cheese or bacon I added. I called the store and they said there was nothing they could do because that’s what came over on the app. Then my food was delivered without a drink. The store wouldn’t come back and deliver my drink OR give me a refund, the only way I could get a refund was if I went to the store and by that point I may as well pick the drink up myself. I asked if they could give me a refund for the major inconvenience of having to pick up my order when actually I got it delivered and they said there wasn’t anything they could do other than give me a coupon… which was expired. I’m extremely disappointed with the app. It’s supposed to make everything easier when it really just messed my order up for the same price. If I get subway again I’m just going to go into the store.",Wrong Order,1,False,,Subway
