,date,userName,review,title,rating,isEdited,developerResponse,Company_name
75,2018-01-31 20:54:46,Slim463,"I love the app. unlike other reviewers, the swiping left on items to customize or remove is a breeze.  My only criticism is the dressings selection.  If you order a salad. there is no where to add a salad dressing, such as fat free Italian. I am only left with the comments area to ask for a Italian dressing.  And most of the time the people at the subway location don't even read them.  I always get asked at the window or register, “Did you want any dressing?  I tell them,”I wrote it in the comment area!” Their response,” Oh we never see or read that area.”.   OH BOY... sad.

I think all dressings should be listed for selection. Yea you get the normal selections mayo, mustard, red wine vinegar..etc... but not any of the other choices. I hope the developer reads this comment / review.  And seriously takes this request enhancement under consideration. 

Otherwise great app.  No waiting, just stop pickup and go!",Works great!  But....,4,False,,Subway
76,2021-10-09 14:49:47,RDU06,"Look, I understand that you want customers on the latest version of your app, but this isn’t a banking or financial services app, and even many of those allow you to use the app, even when an update is available. 

Not that it isn’t already extremely frustrating to be forced to update when all you wanted to do was scan for points or scan to pay, but to make matters worse, every time you force an update you also log us out. 

most of us not are app experts, but all of us have enough apps to have an opinion regarding the difference between good app practices, critical app practices and annoying app practices. Subway continues to fall into the latter - you are not a banking app and if you have to force updates to patch critical errors (at every update) then perhaps you need new developers who don’t leave our data at risk every time a new version becomes available. And if that’s not what’s happening, then STOP WITH THE FORCED UPDATES & ACCOUNT LOGOUTS FOR A FRICKIN SANDWICH!",This isn’t a critical or financial app,1,False,,Subway
77,2021-02-03 03:24:08,bb1769,"I’ve used this app for several dozen orders in the last couple of years. Overall it works, but I’ve had numerous problems including:

1) orders are rarely ready by the time estimated. Usually it’s another 5 to 10 minutes or more. Staff do not appear concerned about this. Of course they can be busy, but what good is a time statement if it’s consistently missed?

2) app does not refund missing items. I added avocado today, but the store was out. The store and app have no way to remove that charge. They offered to give me cookies or a bottle of water, but I didn’t want any of those. 

3) ingredients are often omitted. We ordered a tuna sandwich a few months back. Picked it up, drove to a picnic spot, and discovered the sandwich had no tuna. Today a BMT was missing the pepperoni. No indication the staff realized the omission. There’s no way to report problems or request a refund. 

4) favorites are often useless. If you try to order a favorite, but that store doesn’t have a particular ingredient in the favorite, it won’t let you add it. It won’t tell you what is unavailable. Only choices are “Find another location” and “Continue”—which skips adding the sandwich and returns you to the main menu. It should show you what is unavailable, and then let you add the sandwich anyway and customize as normal.",Ready time is rarely correct,3,False,,Subway
78,2017-09-13 11:01:06,debra31806,"An order was placed at the wrong location (I thought it used the location a) I have selected at ""my location"" and b) the closest to me and NOPE it chose a location 20 miles away. I tried to cancel and all it did was tell me to call the store. She told me she canceled and for whatever reason, I was still charged. So now I've paid for two Subway lunches on the same day/time but only got it once. Now I have to go fight for my money back instead of this app having a more secured way of canceling the payment and not having to trust the store employees will do it correctly. UPDATE: I was able to send feedback through the overall Subway website and was corresponded with immediately and in just under a week (still a little longer than I think it should've taken) I did receive my money back. I had to go pick up cash though (he was able to refund my card for some reason).",Not my favorite way to order anymore,3,True,"{'id': 1246165, 'body': 'We apologize for the inconvenience. Please contact us at 1-800-888-4848 or appfeedback@subway.com. so that we can make this right. Please mention the restaurant location, date/time you placed the order, and your user name when contacting us.', 'modified': '2017-09-13T11:01:06Z'}",Subway
79,2018-08-19 23:09:16,DYM53713,"Downloaded the app, created my profile, tried to add a payment method... no dice. So maybe it will let me after I create an order? Put two customized sandwiches in there, added a couple of cookies, tried to add a payment method... nope. Maybe it doesn’t like Discover? I’ll try adding a MasterCard instead. Hmm... still nope. Well, maybe I have to place the order first? Nope. Can’t do that either. I have an iPhone 8+ and a reasonably new version of the iOS (11.3). You folks just updated the app about a week or so ago. This is disappointing. 🙁

UPDATE: so I saw someone mention updating something on the website... and so I logged in there and - lo and behold! - it let me add my Discover card there. When I came back to the app, I fiddled around for a second and it let me order with my Discover card. But you folks aren’t off the hook! I should have been able to do all this on the app. So please fix that? Thanks!",I was so excited about this app until...,3,False,"{'id': 4783531, 'body': ""We are sorry to hear that you're having difficulties. Could you let us know the city and zip code you were trying to save your card info with, so we can investigate and address these concerns for you.? You may email us at appfeedback@subway.com. Thank You!"", 'modified': '2018-08-23T13:44:55Z'}",Subway
80,2018-05-27 12:07:05,Houserftway,"So I’ve used this app many times actually. I love this app it was super easy to use but now since the developers tweaked it it won’t let me on anymore. When I pull up the main screen and enter my info it said forgot your password let’s get you a new one so I changed it but every time I put in my info, I hit accept new terms it just takes me back to the forgot your password screen. 

       The app is not realizing that I have accepted the new terms and letting me into the actual app, I am not a reviewer by any means but I feel if something’s added or been taken away it’s my job to let you know how things are running and it’s not smoothly. I gave this app five stars because in the beginning the app worked great but now I can’t even use it, it’s only using up storage on my phone.",Five but not happy,5,False,"{'id': 3642151, 'body': 'Developer Response (Pending) - May 29, 2018 It may take up to 24 hours for this response to appear on the App Store.\nWe appreciate your patience while we investigated the concerns you shared with us. We identified the concerns that you brought to our attention, and our support team has indicated that the concern you identified should be resolved. Please uninstall and reinstall the Subway® App from your device, and the concern that you mentioned should be corrected. If you could follow up to let us know that this has been resolved, we would truly appreciate it. Thank You.', 'modified': '2018-05-29T17:55:33Z'}",Subway
81,2019-08-24 21:04:22,Paperfiddler,"The app is buggy - kept making me delete everything and start again if I wanted to change one thing. It kept changing the bread I wanted. Subway REALLY wants me to have 9 grain bread. It made me do 2 orders instead of allowing me to just order 2 sandwiches. We couldn’t cancel our order when the sandwiches weren’t made.

The big problem is that the employees of our Subway weren’t able to figure out what the app said. My husband ran in, they hadn’t even started, and were standing there totally baffled by our basic sandwich orders. He told them we didn’t have time to wait, and to cancel our order. It’s been nearly a week, and the charges are still on our account. We paid nearly $20, in advance, for sandwiches we never got. The bank is going to fight the charge. 

I love the idea of ordering ahead, and picking it up in a flash. That would be great, even if I do have to erase and redo the order a couple of times. But the employees have to understand how the app works, and there has to be a way to cancel a sale.",Employees need app training,1,False,"{'id': 10379169, 'body': 'We apologize for any inconvenience this caused. Please contact us by tapping ""Contact Us"" in the app menu, at (833)-778-2929 or by email at appfeedback@subway.com- so that we can make this right! Please mention your concerns, the restaurant location, and your user name while contacting us. We look forward to hearing from you. \r\n', 'modified': '2019-08-27T14:26:25Z'}",Subway
82,2021-10-17 20:26:04,charityjo,For the creators …  so I actually do like app testing and give feedback as a like side gig and when I use a new app I can’t help but to offer my opinion … when I was placing my order I had multiple similar items 3 subs and many cookies … well everytime i would finish one sub sandwich I was asked if I was ready to check out or continue shopping … Then when I hit continue shopping it redirected me all the way back into the main menu to navigate my way back to the subs all over again … which was irritating and I feel unnecessary. If the customer is adding their last item you may be better off to add in some add on items … preferably your higher selling ones per the general district area … it asked me if I was ready to check out so many times I got irritated and just checked out instead of getting the other chips and cookies I had wanted …,To creators,3,False,,Subway
83,2019-03-12 05:01:27,ClevHifi,"Been using this app for a few months now with no issues. But recently was visiting a family in Ohio and tried to use the app to make a purchase which has been a nightmare. The app has incorrect hours of operation! They charged me for 2 sandwiches and told me they would be ready at 9:30 pm. Show up to the subway store to be greeted by what looked like an employee who hated her job. She told me to come back tmrw for my subs! Fast food should be exactly that I have no interest in driving out to a location to claim subs I needed that evening. They have yet to give me a refund, how an app can simply charge you and have no way of processing a refund is mind blowing. Very disappointed in subway.

FYI did contact customer service and was told the store would need 48hrs to refund and not worry. That time has come and gone with no refund. I love how all the responses are subway cares and to call them to make it right. Don’t bother unless you want to wait for 30 minute to talk to someone who can’t do a thing. App is simply a way for stores to steal money.",Buyer beware..,1,False,"{'id': 7734180, 'body': 'Hi, there- could you reach out to appfeedback@subway.com, with your contact info so my team may make this right for you? Please ask to have the email sent to Chris, and we will look into the concerns right away. We look forward to hearing from you.', 'modified': '2019-03-14T14:32:18Z'}",Subway
84,2018-07-26 01:55:25,Super Max,"Gave it 2 stars because I used to use it all the time to grab a quick lunch while at work.  It was easy to order and even easier to pick up when it was done.  For the past couple months it’s been nothing more than a location finder.  It errors out when trying to order and when looking for the rewards you’ve earned.  It is nothing more than a battery/space hog on my phone due to it being absolutely useless.  **Note to the developer, please do not respond to this review with one of your canned responses.    You’re better off not saying a word than opening up your mouth and confirming to everyone that you really don’t care.  Everyone of your responses are the exact same every time.  Subway has literally lost my weekly business due to your incompetence and crappy customer service skills.  Oh and by the way, your latest update (yesterday) fixed absolutely nothing.  Bravo.",Works great to locate the closest location.  That’s about as far as it gets.,2,False,"{'id': 4410579, 'body': ""We are sorry to hear that you're having difficulties, Max. We would love to investigate these issues regarding successful orders and MyWay Rewards functionality for you personally- but to do so, we need a bit more information and a way to contact you once we have resolved your concerns. We are here for you, at (833)-778-2929, or by email at appfeedback@subway.com. Have your app version, device type, and the steps to reproduce any errors ready- so we can investigate and address these concerns. Thank You!"", 'modified': '2018-07-26T15:23:53Z'}",Subway
85,2020-10-24 15:07:56,GP135790,"This app is no longer user friendly, WHATSOEVER. I have tried being patient but everytime I try to find a way to contact support I just keep getting sent in a never ending loop. The subway mobile app website that says if you are having issues go under the “contact us” in their app... well that doesn’t exist. 

I just want help because my subway offers the flatbread option but for some reason on the app it isn’t showing up. I have tried deleting and re-downloding and it does nothing.  Another big user error is that if I want to get plain chicken strips I have to order the premade bacon chicken sandwich and I can’t eat bacon, and there is no option to remove bacon.

It’s a sub shop, there should just be a build your own sub option.  I really don’t leave bad reviews but I really like subway and this app has been great until recent changes and I can’t get anyone to help me. PLEASE SEND HELP, leaving this review is the only way I can think of to get someone to reach out.",It’s gotten worse,1,False,,Subway
86,2020-10-21 02:31:21,BookerTAS,"If the restaurant isn’t open, you can’t even browse a menu, much less pre-assemble your sandwich in advance. One should be able to pick the sandwich and ingredients they want whenever they want, then submit the order at the appropriate time, or even save it to the Favorites. 

Similarly, you have to submit your order no more than one hour (+/-) in advance of the pickup time. A much smaller (and less affluential) regional chain has managed to make it possible to submit an order not only several hours in advance, but a WEEK in advance. 

One should be able to submit a lunch order before going to work in the morning, so one could just leave for lunch at the appropriate time without having had to use work time to choose and submit an order, or try to do it while rushing to the restaurant during a limited lunch break.",This should be more convenient,3,False,,Subway
87,2018-09-15 18:07:31,Ben1846,"Update: Since I originally posted this review, they have updated the app and fixed the problems I previously complained about.  As a result, I am revising this upward. 

Original: I really love the convenience of being able to order my food ahead of time and pick it up without having to wait in line. Unfortunately, they keep “improving” the app and breaking things.  I dread seeing an update to this app because I never know if anything will work right. Today, I opened the app to order and I couldn’t find my favorites, it kept fighting me on changing restaurants and it kept telling me it’s pickup time for an order I picked up two days ago. 

I finally managed to get the restaurant changed — or so I thought because the screen had the restaurant I wanted — and started an order from a previous order. I favorited the sandwich, but favorites still don’t appear anywhere.  To add insult to injury, I opened the email confirming the order and guess where it sent my order — to the subway it didn’t want to let me change away from in the first place. 

This seems to happen whenever there is a major update. Functionality either disappears, fights you, does the wrong thing or just doesn’t work at all. It’s really frustrating and I’m sick of it.",Improving over time.,4,True,"{'id': 1752027, 'body': 'Hey there- we apologize for the confusion! We updated the app with a new feature to save a favorite without saving it to a specific location. Set your order as a favorite after checkout on your next order. Now you can tap on the ""favorites"" section after tapping ""start order"" for any location you\'re ordering from! For technical concerns, please contact our support team at (800)-888-4848 or by email at appfeedback@subway.com. Thank You!', 'modified': '2018-09-15T18:07:31Z'}",Subway
88,2020-09-17 21:08:01,Princessgamble,"The app functions well but really caters only to customers that want to order specific menu options. There should be a “customized sandwich” or “create your own” option to allow customers to order exactly what they want. All menu sandwich items have locked items that the customer cannot remove. My specific location doesn’t honor promotions or member points unless you order through the app because they don’t have a scanner on site. Some locations may have different ingredients from other locations and if that’s the case then the app should pull based on the location. I realize that requires more work but it provides full service to customers which should be the priority. In the end, I can’t even use the app or benefit from promotions or member points due to not being able to fully customize my order.",Needs Work,3,False,,Subway
89,2021-12-15 21:36:05,scooby😔,"this app is fine, it does the job mostly. i however have had experiences where it absolutely went non-functional and i’d get stuck on loading screens and/or have to redo my order. quick customization and pickup is nice—but delivery feels like a scam. they make a big deal about “free” delivery and other discounts but the majority of discounts you apply will be negated by the small order fee. i understand and celebrate the need for adequate pay for delivery drivers, but giving me a $3 off coupon and adding most of it back kinda defeats the whole purpose of having a discount to begin with. this issue won’t effect larger orders, but for someone like me who’s just ordering a meal for one (which i imagine is the VAST majority of users) it’s pointless. just save us the trouble and don’t hang discounts in front of our faces if they don’t mean anything :/",yahooey subway app yum yum,3,False,,Subway
90,2021-10-20 23:34:59,Erinesque,"I placed an order for delivery through the Subway app.   Apparently then, a DoorDash delivery driver came into the store to pick up my order, but Subway had never received it, so I never got my delivery, and got a notification that my order had been cancelled.   I called the store directly, who then took my order over the phone and I had to go get my food as a pickup.  The employees told me that they never have had any delivery drivers and were very confused as to why there was a delivery option on the app when they have no delivery at all.   They were also concerned that the order was never submitted to them from the delivery app.  

So, because this was inconvenient for both me and the employees, I’m rating it a 1, and will be deleting this useless app.  

When I use an app, I expect it to work, and I expect it to communicate to the restaurant it says it does.   This does neither.  The employees were great, and made up for the poor quality of this app.",Very disappointed with the app,1,False,,Subway
91,2020-09-14 17:37:28,jahahsys,The app is good but needs improvement. It needs improvement in my opinion around the store location button . And I guess she read my GPS and see where I at I was sickness I want Subway. Like I should read my GPS and see where I’m at I was sitting there so I want to Subway and ordered from another subway seven minutes away previouslyAnd it sent my order back to where I had previously ordered which was a hassle but I needed to double check that IAdmit that but it would’ve been a lot easier if it double checked and verified where I wanted to place my order. Also canceling ordersShould be a really a one button push instead of a phone call and there should be a feature where you double check if you’re sure you want to place the order instead of one touch press your order is going to be ready etc.,Is good but need improvement,3,False,,Subway
92,2021-07-10 00:19:14,bippy_b,"My kids eat Subway about once a week so when I saw there was an app I was thrilled. Downloaded and it was buggy at first but it seems they just had a few launch hiccups. So if you had problems before.. circle back and try it again. The main issues I have with the app is the fact that I can’t “pre-build” a favorite (or at least it isn’t obvious where I can build my custom sandwich and favorite it without submitting an order). I tried to pre-build and save as a favorite so that the next time i headed there.. I could submit my kids order, walk in and pickup .. but no. That isn’t an option. One has to submit an order first and THEN you can favorite it. The second issue I have is no Apple Pay. Come on guys.... it isn’t that hard to add in!",Great app with a few minor issues,4,True,"{'id': 10265623, 'body': ""Your feedback is really important to us and we're always looking for ways to improve your experience! Feel free to reach out to our team by tapping 'Contact Us' in the Menu, at (833)-778-2929, or by email at appfeedback@subway.com.\r\n"", 'modified': '2021-07-10T00:19:14Z'}",Subway
93,2021-03-25 20:57:27,momran84,This is the 2nd time that the app has submitted and order before I was ready. The first time wasn’t a big deal because there weren’t any coupons but today you had the promo for the buy one get one for $1. Right after I hit the second sandwich the app closed and when I reopened it the order was submitted before I was able to add on my other two footlongs. Called the store and they couldn’t understand why I was upset and told me just to add on the other sandwiches with another app order with the coupon but the coupon is gone. They kept telling me it would work but it wasn’t showing up on my end and I wasn’t going to place an order and be charged something different. This is my only frustration with the app I love the deals I don’t know why this has happened twice now. And I usually only treat my kids to subway if we have app deals so if this can’t be resolved well unfortunately have to be done with subway.,App submitted orders before completed,1,False,,Subway
94,2021-01-22 22:24:41,SLambo82,"I loved this app. It was so convenient to be able to pick up a quick lunch, and with 1 click be able to order, and pay my last specific order “4 people” without any hassle. However today I hit “repeat last order” on the app Only to walk in and have some kid yell “cash only man!” I said “that’s cool I have already paid, with Apple Pay on the app I can show you the proof from my bank”. He said “oh I have to call my district manager and see what you ordered?” After 26 minutes of waiting for this dude to call back I said “this is not worth getting fired over” (lunch break)! And went back to work. I could call my bank and say “I paid for nothing” who would believe that? I could call subway and received nothing and be in the same boat. So I’m out $25. There is no safe guards on this app. You probably could order, and after hours only to show up to a closed building. This app is awesome just call first to verify they are functional.","Great app, just not for food.",1,False,,Subway
95,2019-05-28 20:50:12,GeekyGirl007,"UPDATE: Subway fixed the issue and I was actually able to place an order from the app. Thank you, Subway!! Updated my rating from 1 star to 4. 

The only reason for 4 stars and not 5 is because the user experience could be better. While the new experience looks cool, I like the old user experience better because all options were right on the same screen. For example, I wanted cheese on my sandwich and had to go hunting around until I found on a separate page I could add it. It’d be nice to have all options available on the same page. But it’s usable and I’m just glad I can order from the app again! 

ORIGINAL REVIEW: App just sits at loading screen. Been doing this for several months. Still doing it after most recent update. This happened on my iPhone 6 and is still doing it on my iPhone XS Max.",Doesn’t work,4,True,"{'id': 8764255, 'body': 'Thanks for reaching out to us, and for your patience while we corrected this issue. We heard your feedback loud and clear, and now have a fix for the pesky issue you described (which will not require you to have location services enabled to login). \n \nPlease update to the latest version of the Subway® App, and please feel free to call us at (833)-778-2929 if you are still experiencing any issues.', 'modified': '2019-05-28T20:50:12Z'}",Subway
