,date,isEdited,review,userName,developerResponse,rating,title,Company_name
140,2020-11-12 07:20:51,False,"By far best fast food app

Issues
1-Location step almost ignored... It’s a fundemantal step... Allows you to accidentally order at the last store four stores away
2-Pickup options like store location non issue until to late... You can walk a mile to the restaurant, hit here, then learn store closed drive-thru only
3-If you order a hot fudge sundae you shouldn’t be handed a sundae without hot fudge, ice cream or nuts after arriving... McDonald’s world best fries were ruined without the Talo, the only reason I stopped for years... The huge sodas are gone... K, health police might be right... But no nuts on a sundae ridiculous, if Mom’s gave their kids nuts earlier we would have our kids lives re-ordered for the tiny few
4-It’s false advertising to have a tripleCHEESEburger with two slices of cheese... That’s why there is a McDouble and a Double Cheeseburger
5-A CHEESEburger should be made with cheese not cheese food or cheese product... Why the food Nazis permit false fraudulent non cheese amazes
6-SIMPLIFY the menu... The made to order 1/4 pounder is the bomb... Gooey cheese, liquid juices instead of stale pre-cooked like warm
7-McDs coffee was always fresh... It always had the correct amount of sugar and cream... Now it’s either stale, short sugar or short cream 50% of orders
8-Bravo... Finally something to go with coffee... How stupid to give coffee away without an upscale option, now three",nsmanc,,5,Store Location/Pickup options,McDonalds
141,2020-11-06 20:43:28,True,"I have tried to use this app several times and have always had a lousy experience. The first 2 times I ordered before I left my house only to find out that they will not start building your order until the app knows you are in a waiting stall.  Then you watch car after car exit the drive through with their food while you wait. Then tonight the ultimate experience when I pulled into a parking spot in the McDonalds lot. I selected the I’m Here icon and the apps GPS said I don’t think your here. So I couldn’t proceed. I eventually put my mask on and walked in to order at the counter and cancelled the order I tried to make on this app.  The app should not be using gps to do this because when you report you are there, the next thing the app should do is ask for a stall number.

Update: after McDonalds response to this review I have decided to remove the app. They will not prepare food until you are in the parking lot AND this Crummy app acknowledges your presence or better put, might not acknowledge you when you are there.... so they will NOT prepare your food while you sit in their parking lot!",Radiohalo,"{'id': 18901581, 'body': ""That doesn't sound like an awesome Mobile Order experience. Let us look into this. Please provide our Mobile App team with more info at https://www.mcdonalds.com/us/en-us/contact-us/mobile-app-questions.html."", 'modified': '2020-11-06T20:43:28Z'}",1,This app tries to be too smart,McDonalds
142,2019-08-26 15:24:25,False,"It’s a great app besides mobile ordering. I placed a mobile order for my 16 yr old so she could eat dinner. I ordered for my local McDs and left town... about 35 mins later, my child calls and says she is in parking spot 1 for mobile pick up. We do this all the time with another restaurant so she can eat while I’m away. So I clicked “im here” thinking i could just tell the app which space She was in.  Nope. It doesn’t work like other mobile ordering apps for other restaurants. You have to have that phone in the McDs parking lot. I ordered 10 piece nuggets and that is it. Once I clicked “im here”, my order got all jacked up, it was sent to the McDs i had just passed 30 miles away from her, and it had submitted for a fish sandwich, a drink, bacon Big Mac, slushee... not even the 10 piece we ordered. It charged my card for those items. I called customer service for help and she had no idea how to help me but said charge would probably fall off in 48 hours. Nope, it still charged my card. The  cancel items button was no where on the screen. I’m not sure what happened but I won’t be using mobile ordering again.",Aimee1219,,2,Don’t do mobile ordering,McDonalds
143,2018-08-18 14:22:00,False,"The app itself is great. I got a meal for $7 only I didn’t get the meal I actually wanted. I ordered a strawberry banana smoothie and sugar cookies which is what I got. And then I got my free medium fries. But I also ordered (and I really wanted this the most because I’ve been craving it) a salad with grilled chicken and cheese. So when I arrived, they gave me half my order, made me stand there for 15 mins letting me miss 2 of my buses and when I spoke up about it they told me “we don’t have any salad” and they knew this the whole time but watched me stand there and wait for my order. I was patient at first because they were slightly busy but it’s ridiculous that nobody could speak up and say this from the beginning. A compete waste of my time. I wanted slightly to be healthy but they made me order nuggets as a replacement. When ordering from the app and choosing the location, I think the managers who work there should check off anything that’s no longer in storage so us customers shouldn’t have to waste our time and my money. I wasted my money on something I didn’t want.",...Anazyah,"{'id': 4878829, 'body': 'Hi there! We always expect your service to be stellar. Having our staff trained and knowledgeable about our Mobile App is important to us. Please provide some more info at https://www.mcdonalds.com/us/en-us/contact-us/mobile-app-questions.html, so we can address this.', 'modified': '2018-08-30T22:39:48Z'}",3,Wrong Order,McDonalds
144,2021-09-09 12:30:10,True,"Additional comment a few years later: I can no longer customize some sandwiches like I used to be able to do. Please bring that back, including customizing breakfast sandwiches and burritos. Thank you. 

I have had this app since nearly its inception. It started out well, then got worse with only having coupons for fries or coffee/frappes for the longest time, finally has gotten better with many varied and usable coupons, but now hit the ultimate low in which I can only use just one deal a day and I cannot use anymore than that unless it has been over 24 hours. This is just ridiculous. I leave for work at variable times each morning. I love my local McDonald’s and I am nearly a daily customer. I have other options on my commute to work, and might be visiting those places now. Please remove this silly new restriction, forcing me to wait 24 hours, and go back to how things were.",Badgermomto3,"{'id': 4800394, 'body': 'Oh no! Most times this can be fixed by uninstalling and reinstalling the app. If that doesn’t resolve your issue, give us a call, so we can look into this further at 1-877-334-4332.', 'modified': '2021-09-09T12:30:10Z'}",4,Can’t use again unless it’s been exactly 24 hours,McDonalds
145,2019-09-10 13:51:47,False,"Believe it or not McDonalds, you're losing a lot of business with this latest aap.  If you can't fix the problems with this aap, then at least revert it back to a version that worked!  The Dunkin Donut's aap (and I'm sure many others), have worked flawlessly with no such problems as this one.  And even when they did have a glitch, they put out a ""fix"" right away!
I'm having the same problem as others who say their credit card information isn't being saved by the app making it useless.  It's been quite a while since the developers have been saying they're ""looking into it"".  With all the efficiency, strategy and methods McDonalds incorporates into their restaurants, I'm at a loss at how this can even take place.  Because it's taken this long with still no solution, maybe it's time to go over the Development team's heads and speak to corporate management!",Neil_22,"{'id': 10638013, 'body': ""Hi there, Neil! Since we want your experience to be a flawless one, we appreciate you bringing this to our attention. We'll make sure to let the appropriate team know. Thanks!"", 'modified': '2019-09-11T20:15:47Z'}",5,Aap has not been working for some time!,McDonalds
146,2020-11-03 03:50:13,False,"This was an excellent, reliable app.  I appreciated the deals - but especially the ability to submit an order with specific details (eg,#ketchups, BBQ sauce, etc) in advance without having to yell into a microphone.   

One day, completely out of left field, the application fails. I delete the old app, shut off my phone and restart, then reload the application. But to no avail! I keep getting the same failure message! I tried this at least five times on different days.  

I have a relatively new iPhone with plenty of available utilities space and excellent internet connection and so I don’t understand what the problem could be. I’m extremely disappointed.  I always thought of McDonald’s as a quality organization with the resources available to offer and support a reliable phone application.  The app’s ongoing failure unmistakably tells me that McDonalds just doesn’t care about its customer’s experience.  Consequently I refuse to patronize any McDonald’s establishments until this failure is corrected.  Unfortunately, from what I can see - I guess this means I will never return.  Oh well, Wendy’s is a more than acceptable substitute.",Dgf39,,1,What happened???,McDonalds
147,2020-03-14 22:44:00,False,"I don’t get it...I’ve been using this app from the get-go, and just when I think progress is being made, I get blindsided by another deficiency.  One step forward and three steps back.  I downloaded the latest version of this app in February and I can no longer customize my items.  For instance, if I click on a beverage, it defaults to a medium, so I can’t change the size to a large or can’t customize to request half sweet/ unsweet tea.  I visit McDonald’s on the daily and sometimes multiple times a day.  This is beyond disappointing and frustrating.  Another issue I encountered is that the app no longer gives you the option to add the item or the meal.  It simply adds the item for you and then you have to add the fries and drink separately.  One major benefit of using the app, is that I’m entering my order, so it minimizes the room for error.  My order is transmitted as I entered it.  If something is wrong, it’s highly likely that it was my error and not McDonald’s.

Please fix these issues!  The app has come a long way, but this has really discouraged me from using it or visiting McDonald’s.",VolunteerATX,"{'id': 14098098, 'body': ""We're sorry about the difficulties you've had! Please provide our Mobile App team with more info at https://www.mcdonalds.com/us/en-us/contact-us/mobile-app-questions.html, so we can look into this further.\r\n"", 'modified': '2020-03-18T17:44:16Z'}",2,Can’t Customize Orders or Add A Meal,McDonalds
148,2021-03-15 15:23:19,False,"When this app works it’s really great. The deals are great too, and the UI is very straightforward. But there’s some odd glitches/features...
-After paying for and getting your food, the app continues to monitor your location. You’ll drive an hour away, look at your phone, and for some unknown reason the app is still using your location. You have to force quit to make it stop.
-When you next use the app, even if weeks later, it retains your last order as if it was never completed. You have to go and delete the items in order to use new deals, or to avoid some message about how breakfast is over (even though you don’t want breakfast, it’s just retained that breakfast order from a month ago)
-The app doesn’t always register when you’re at the location, even after clicking that you’re there. This may partially be due to employee training, but after years you’d really think that this was something that McDonald’s could get down
-It always assumes you want the closest McDonald’s, which may work the majority of the time... but if you’re traveling in a different direction (e.g., to work in the morning on the same route you take everyday) you have to manually change location every single time. Would be nice to set default restaurant
-Not so much the app but instead probably McDonald’s, but it’s a bummer you can’t use multiple deals... especially your McCafé reward with another discount.",Time93,,3,"Great when it works, albeit with some odd glitches",McDonalds
149,2019-01-09 20:02:28,False,"I tried this app in the past, but the glitches never allowed the order to go through. It’s been awhile, so I decided to try again. My order went through okay, but took forever to get (I picked my order up inside). Turns out they had my order ready, but never called the number, so it was just sitting around. When I got home, I was missing a sandwich and fry. I called the store and they asked me if I would like to come pick it up. No thank you, it’s 15-20 minutes one way and just not with it, would they please refund those items. I was told they can’t because I used the mobile app. They said I had to call the corporate number on the app for a refund. I called. It took 20 minutes to fill out the necessary paperwork, which only sent a refund request to the owner of the store, I still have to wait for someone to contact me about getting my money back. 

This will be the last time I use the app. I had hoped it would make my stop more efficient, but I have eaten up about a half hour between talking to the store and corporate, and I still don’t have my money. I am extremely frustrated with the whole experience.",HSMomX3,,1,More Frustration Than It’s Worth,McDonalds
150,2020-04-16 18:11:47,False,"I’m amazingly optimistic. So I rarely do negative feedback reviews. So I’m not excited about it. I’ve had the app for about a year straight. I love McDonald’s and so does my family, but the app is not there when it’s needed most. 8/10 times I’m ready to use the app or use a coupon at the window, it fails out for whatever reason. Stays continually loading, repetitively logs you out and just flat out closing the app. Sometimes we’re not always able to mobile order or dine in, so keeping the line held up for 5 minutes while I figure the App out is something I’m not comfortable with. The coupons bring me to the restaurant, but I hardly get to even use them. I’ve kept it for a year or so BECAUSE I am amazingly optimistic. So I gave it a fair try. I’ve found that the app makes me a bit more frustrated then just not having the app. Knowing there is Coupons and Deals but no way to get to them most of the time, just is a Bummer. So my solution until improvement is “Out of site, Out of mind.” If I don’t see the deals then at least I can’t be mad if I don’t get them. 

Sincerely, 
Worlds Most Optimistic Guy",ZJG11990,"{'id': 14737086, 'body': ""Hi there! We're sorry to hear you're having trouble with the app. To get you back to the deals you love, we suggest uninstalling and reinstalling the app. If that doesn’t resolve your issue, give us a call, so we can look into this further at 1-877-334-4332. "", 'modified': '2020-04-17T16:06:19Z'}",1,Space filler app,McDonalds
151,2019-07-07 16:37:04,False,"I enjoy using the app to order, but as another person noticed lately it is leaving my prior order in the cart instead of actually clearing it And there doesn’t seem to be a way to take a deal out. It will let me delete the food from my cart but Not the deal, so when I tried to add another deal it says there’s already one in my cart and I can’t use more than one. Even though the existing one is unavailable since I’ve already redeemed it. It’s just sitting there blocking my cart from being used for anything else and it’s completely annoying. The only other thing I would add is that drive-through staff severely need some training on how to treat app orders. Invariably they tried to hand me the food for the person behind me because they don’t apparently have a way of placing the app orders in Queue sequence With the orders being manually entered at the speaker. Depending on the location sometimes they even make me feel like a weird kind of zoo creature as if placing a mobile order is so rare and unusual that if it’s not ubereats they can’t fathom that I exist. So that’s kind of disconcerting as well.",MikesterAZ,"{'id': 9600237, 'body': 'Hi there! We always expect your service to be stellar. Having our staff trained and knowledgeable about our Mobile App is important to us. Please provide some more info at https://www.mcdonalds.com/us/en-us/contact-us/mobile-app-questions.html, so we can address this.', 'modified': '2019-07-10T21:06:42Z'}",2,Clunky,McDonalds
152,2021-11-13 12:34:07,False,"Overall I enjoy using the app but be aware that those that choose to add a credit card to auto pay - that in the event that an item or items that you order are not available AFTER you’ve paid at the drive through, getting a refund if said McD’s is privately owned will be a nightmare! This has happened to me in the past when I ordered breakfast sandwiches that the app showed were available yet when I went to the window they said sorry we don’t have those or are not serving those at this time yet I had already paid for them! They told me I had to call the 800 number in the app to get a refund but again since it was a privately owned McD’s I had to contact the owner to get a refund. The rep on the phone supposedly sent my email address and name to said owner but I never heard from them meaning I ended up doing a charge back on my credit card and had to keep an eye out on my bank statement to make sure I was actually refunded = What a pain!
I never did hear from said owner.",BasicThreads,,3,Warning!,McDonalds
153,2021-10-31 03:51:04,False,"Initially I didn’t have any problems with using this app. I found it was user friendly and convenient. The only issue I found then was the limitations on rewards used per visit. Now over a year later, I’m experiencing problems with using the rewards. When I try to use the app during breakfast hours, only lunch or dinner items are accessible (which the restaurant isn’t going to honor). And during lunch or dinner hours, only breakfast items are available. However, when I tried to see if I could order the available reward, the app still didn’t permit me. So basically I’m only able to accrue points, but unable to use any of them. I also asked a manager for assistance and unfortunately they weren’t able to troubleshoot the problem. 

One other issue, is I also don’t understand why McDonald’s doesn’t permit you to use your receipt to add missing rewards. This is the only app that I have, where I cannot add my points later (in the event the app want scanned).",Lady Renshaw,"{'id': 26042081, 'body': 'We want to make the best app we can for you. Contact our Mobile App team at: https://www.mcdonalds.com/us/en-us/contact-us/mobile-app-questions.html', 'modified': '2021-11-02T18:35:03Z'}",3,Technical Issues,McDonalds
154,2020-11-20 10:13:30,False,"It use to be a good app I use for few years with no problems. Now it won’t allow me sign I already have a existing account but it keep saying at the top of screen there are some technical difficulties try again later or reset app. I use the same email address & password & won’t let me login this been happening this year when y’all had the J Balvin deal with BigMac, medium fries, & an Oreo cookies & cream McFlurry. I am very disappointed because I can’t even get the coupon deals on app any more like I use to before. I think it’s the updates the more the app being updated the more problems we run into. When I first use this app I sign in through google like always now it says google is canceled when I put email & password in. So please fix the login process I restart the app & even try to register again & change password it wouldn’t allow me to. Also now I don’t even see McDonald’s sending notifications of deals to email anymore. I’m just so disappointed because I liked this app in the beginning until it started messing up. I may just delete this app & be done with it.",Monibaby24,,1,Dissatisfied with McDonald’s app,McDonalds
155,2020-03-23 07:41:14,False,"Mobile ordering has never worked for me. There’s always some sort of error and it usually involves the location not understanding how to handle mobile orders. The last time I tried was to get a deal on a coffee offered by the app. I made my mobile order and went to the correct location I chose. I selected drive thru because the location wasn’t open inside. When I pull up to the drive thru I get nothing. 24 hour McDonald’s and I’m being ignored at the drive thru.. I pull up to the first window and a girl is standing there and tries to pretend I’m not there. I have to wave for her attention, when I get her attention I explain that I made a mobile order, she looks puzzled and tells me to hold on. I proceeded to wait a whole 10 minutes for them to figure out my mobile order and how to process it. By the time I get my coffee and I’ve spent almost 15 mins in the drive thru and to top it off they didn’t put the correct amount of cream and sugar that I requested in the app.. This has been my experience with mobile ordering every time I’ve tried it through out the years and I keep making the mistake of trying it again.. IM DONE!",InMyOpinionMinion,"{'id': 14244916, 'body': ""We're really sorry you were disappointed! Can you provide some more info in this link https://www.mcdonalds.com/us/en-us/contact-us/restaurant-feedback.html/ so we can look into this further.\r\n"", 'modified': '2020-03-25T16:44:38Z'}",1,Gave it many chances..,McDonalds
156,2020-02-12 10:07:08,False,"When this app was originally launched, it was absolutely AWFUL. There was this big push from the company to “get our app, get our app”, but it really was more of a waste of time than it was anything productive or efficient. However, time has evolved and I have to say the team behind this has done an amazing job making the app much more user friendly, improved functionality, etc. The only area of improvement I have now is around the deals offered within the app. There needs to be more of a variety of deals available, as they tend to be a repetitive or very similar. In addition, I’ve encountered several issues with being able to use these deals in the restaurant, even though an option is given to scan it at the restaurant - this is if the restaurant even accepts deals. They’re only “valid at participating restaurants” and I seem to find more restaurants that are not participating versus those that are participating.",VegasBoy2789,"{'id': 13449987, 'body': ""\rThanks for reaching out! We're continuously working towards an improved McDonald's Mobile App that our customers enjoy using. Thank you for helping us reach that goal by voicing your concerns."", 'modified': '2020-02-12T21:48:18Z'}",4,"Great Improvements Made, More Deals Needed",McDonalds
157,2019-06-07 10:21:13,False,"I like the app a lot now that it is running more smoothly than it had at first. There are two things I would change if I could. 
1. In the promotions tab on the ordering menu, make it more clear what the promotions are. Like right now there are breakfast sandwiches on 2/$4, but when you go into the promotion tab, it just shows the sandwiches. Nothing about needing to buy 2 or anything. 
2. This is totally just a personal thing for me but would allow me to use the app to order more often..... in the sodas you have ice or no ice as options. I usually order light ice. I know it seems kinda silly, but it’d be nice if I could get my stuff the way I want it without having to bother the staff to change the order when I arrive. 
Otherwise now that the bugs are mostly worked out and the staff know how to deal with mobile orders and coupons,’I like the app and the deals it gives. Worth it, even if you only go to McDonald’s once in awhile, for the coupons.",Kelly7484,"{'id': 9158384, 'body': ""Hello, Kelly! Our goal is to make sure our customers enjoy using our app and your feedback will help us understand how we can improve it for our customers. We are continuously working to improve our McDonald's Global Mobile App."", 'modified': '2019-06-13T20:53:40Z'}",4,Needs to be more clear,McDonalds
158,2018-11-07 16:50:48,False,"App works ok but is lacking features. Ordering and selecting Cash as payment should be one feature available for drive thru and inside pickup. (I understand curbside should be prepaid with credit card). 
Also customizing sandwiches needs more options. For example you Can’t change a plain roll to request an artisan roll. When you redeem a free beverage reward the choices should be categorized in some fashion. Right now I have to scroll through a huge list of drinks to find the one I want. Changing pickup location can be difficult. GPS location seems to be a problem. When I was sitting at a McDonald’s parking lot on New Britain CT it told me I was ordering at another McDonald’s 2 miles away instead of the one right in the parking lot I was at. 
 Removing an entire order from shopping cart tends to be difficult. Also viewing recent and pst orders on the app lacks much detail such as time, payment method used and prices paid for each item. 
It’s a good start and have seen some nice improvements but more can and should be done.",Nbmich,"{'id': 5864689, 'body': ""Thanks for reaching out, friend! Our goal is to make sure our customers enjoy using our app and your feedback will help us understand how we can improve it for our customers. We are continuously working to improve our McDonald's Global Mobile App."", 'modified': '2018-11-08T21:00:46Z'}",3,Good start,McDonalds
