,date,userName,review,title,rating,isEdited,developerResponse,Company_name
120,2020-04-20 20:18:16,MissTeeTeeNY,"Your app is defective. Why is it that on the other food delivery apps CUSTOMERS choose whether they would like their sandwich toasted or not but on the actual SUBWAY app SUBWAY has made the decision to TOAST all sandwiches by default unless the customer specifically chooses not toasted? Why is TOASTED chosen for us and the app allows the customer to submit the order without choosing for themselves? I feel that the app needs an update that UNCHECKS TOASTED and allows the customer themselves to choose how they would like their sandwich prepared. 

Another company would have compensated me for my negative experience while Subway just says, “Thank you for your feedback.” Yeah, I think that was my last Subway experience.",Toasted or Untoasted? That’s the question!,5,False,,Subway
121,2018-03-08 03:33:45,Putmic,"The problem is that it not only re-orders the sandwich and sides, but the app also chooses the same store location even though a customer just selected a different store. 

Generally I like this app. I was frustrated when today I placed an order from it. I found a store that was near me and convenient for pick up and ‘selected’ that store. Then I went to the handy recent orders tab. There it lists what I have ordered in the past. It also shows the date, time and location of those purchases. I selected a sandwich from that list and chose to re-order it. I was disappointed to find out that I needed to drive another 30 miles to claim my now 45 minute old, not so fresh sandwich.",Recent Order tab auto fills order location,5,False,"{'id': 2817518, 'body': ""We are sorry to hear that you're having difficulties. Please contact our support team at (833)-778-2929, or by email at appfeedback@subway.com. Have your app version, device type, and the steps to reproduce any errors ready- so we can investigate and address these concerns for you. Thank You!"", 'modified': '2018-03-13T20:48:07Z'}",Subway
122,2019-06-21 17:53:12,IHateIceCream,"Downloaded because I forgot my wallet at home. Just like any other food app, I could order and pay with my card info without the need of my physical card. However, I didn’t like how there wasn’t a create your own sub option. I was restricted to select from the existing menu options, and I couldn’t even remove certain meats from those. Since I was already present in the store I just instructed them on how I wanted it, despite how the app forced me to order it. Would definitely be better if I had the freedom to create my own sub, or AT LEAST remove core meats from an existing sub.

Specifically I just wanted a 6-in ital. herb & cheese w/ pepperoni and shred. mozz. (literally that’s all), but was forced to order a spicy ital., remove everything, and request no salami personally.",Convenient but needs more options,4,False,,Subway
123,2021-07-24 19:24:49,KaranB001,Customer service was excellent but my major problem is the Subway app. Why is there only one person working at any location at a time? What is the purpose of ordering through the app when I have to wait 45 minutes for my order. That is not just this location. It has happened at other subway locations too. I order through the app for many restaurants but SUBWAY takes the win in the slowest service through the app. Cannot blame employees because there’s only one at a time. How can they take care of customers waiting + the ones who ordered on the app. I gave Subway three chances at three different locations via app. The app is the most useless creation and a waste of time for the developers who created it. It serves zero purpose. Service is slower thru the app compared to me going regular to order.,Too long to get order through app,2,False,,Subway
124,2021-04-06 07:41:50,TechNot13219,"Placed my order. Waited until the due time. Went in. Waited. Asked if they received my order. They did. I waited and waited. Watched customers come in get in line and get service without placing order ahead. They got their food and left more came in and got served.  I was in the store. Tried standing in line. Apparently the giant online order ahead of mine made me invisible even tho regular customers were being served. Horrible experience all around. Actually self boycotting subway completely because of it. At least after digging for an e-mail we received our money back, since you know, I waited 30 minutes and never got my order even started. 
I’ve been using the subway app for a couple months now. It’s generally ok. But this experience trumps any of that. It was rude and unprofessional to say the least. Zero stars.",Don’t use the App unless you want to wait longer than if you went in as a regular customer,1,False,,Subway
125,2021-06-26 22:30:25,DarKnight1346,"The app is great, love the functionality of the app, but the ordering process needs some work. First, I tried to make the order as a guest, but was forced into signing in. Second, when it came time to pay, it took 3 times of attempting my order before it went through with Apple Pay. Third, the “I’m here” button doesn’t seem to work. After clicking the button, confirming I’m here the screen flashes. After 5 times of doing this, the app is stuck in a loading state. I waited 20 minutes for someone to bring my food before finally walking into the store. I give 3 stars as I’m a developer myself and the amount of work that went into making an app like this doesn’t go unnoticed. That being said, I wouldn’t release an app like this without the flaws worked out.",Needs a little love,3,False,,Subway
126,2021-01-12 10:44:37,Vahally,I used to LOVE this app because I could order ahead of time and pay from the app. It saved me time on my lunch break because all I had to do was pick up my order. Now the stupid app isn’t taking my payment information. I have gone through the trouble of choosing my order and getting to the check out only to find that the order won’t go through because there’s no card on file. I’ve tried several times to update the info but all I get is an error. I have lost my rewards because of this. And I can’t take advantage of the app only deals or online order deals either. I tried to contact customer service but everything is done online and there isn’t an option for app support. I’m so frustrated about this. I used to love Subway and the app but I have not ordered from them in almost a year.,I can’t order from the app anymore,2,False,,Subway
127,2019-04-11 03:53:52,cc-pale,"Multiple different times I have tried to place a mobile order and it will say something went wrong at checkout. I go to my bank account to find that it charged my account multiple times. (I will however say that they stayed as pending and have gone away. I’m bothered by the inconvenience of it) The time between the first time this happened, to the last time I tried using the app was a couple of months. I was sure whatever was wrong was fixed at least a few updates ago. But no. Same issue. Staff is always rude when I call about questions (which I understand isn’t the apps fault, however I wouldn’t have to call and stress myself with having to do so, if the app just worked in the first place) and I just feel like it’s not worth keeping the app and trying anymore. I use to use it often because it’s such an amazing app without these issues.",Not worth the trouble,2,False,"{'id': 8279259, 'body': 'Hi there, and thanks for reaching out again. The behavior you are describing leads us to believe that you are experiencing a payment issue. You may want to delete your stored payment method and try adding it again, and potentially contact your bank or credit card company to ensure that the information you are using, matches what they have on file.Thank You!', 'modified': '2019-04-18T19:22:33Z'}",Subway
128,2021-03-16 22:15:49,kt123536,"I’ve had this app for a little over a year and it has been great to be able to order ahead and dodge lines when I’m on a tight lunch schedule. It’s easy to customize your meals and then simply go inside to the pick up area for your order. Sometimes they have decent deals If you order through the app (sometimes they aren’t so great). One thing that I disliked was not having coupon codes, but they have that feature now which is great! I did have an issue since the most recent update with the app not locating any locations near me but only my own location. But I deleted the app and redownloaded it and haven’t had any more problems!",Love this app!,5,False,,Subway
129,2020-04-11 23:37:45,Bgs1517,"I love having the app. We try not to eat out too often. When we do, we like subway more than most, and it is super convenient to order ahead of time. Unfortunately we are unable to select the drink we want from the app. At least I have not been able to from my IPhone. Also I frequently have trouble getting our local store on the phone to try and communicate any kinda choice or question I might have. So that could be another way to utilize the app. If there were a customer satisfaction survey with each transaction it would be a paperless and secure way of providing feedback on the quality of service provided at each location. Also, I’m not exactly sure how to use our circular coupons with the app. That is probably something I have overlooked though.",App selections,3,False,,Subway
130,2021-04-14 00:38:43,average order,"Tried to order on website and it kept saying fraudulent card after dozens of attempts and double checks to make sure every number was correct. Assumed it was an attempt to get me on the app. Got the app and instead of it saying “fraudulent error” it just wouldn’t add the card as a payment method. I tried that dozens of times only to complete the whole form for the card, hit done, and have nothing added to payment methods. It simply wouldn’t save the info. Updated new phone so that isn’t the issue.  Ultimately sent someone to the store for me and the order was 3 identical sandwiches. One was on the wrong bread all together and each either had an extra topping that wasn’t ordered or was missing one that was. Terrible experience overall. Subway purely based on the menu should be amazing but the app, website, and workers are subpar to say the least.",Couldn’t add card as payment method on app or website,1,False,,Subway
131,2020-08-25 21:08:55,Deb in Utah,"Received email deal for $5 foot-longs if ordered 2 online.  
Went to Subway app, where I have acct and was going to choose our favorites, but guess what...no favorites listed.

Started new order, went through menu and ordered from scratch.  Went checkout and received error that items in cart did not match user.  Went to my acct info, looked good.  Couldn’t figure it out.  Then thought maybe deal expired, but it hadn’t.  

So then figured maybe have to order thru email.  So back email, app same and again no favorites to choose from.  Fooled around a minute and located my favorites at a store I had used previously, but not one I currently wanted to use.  Bummer.

Again started new order and previewed written summary of each sandwich.  Looked good.  
Went checkout and would not take credit card info.  Put in new credit card. Wanted scan new card, but that was not working.
Had keep going in and out of app and for some unknown reason it finally worked.  30 min later I had a confirmation.  Whew!  

Picked up food, got home and order was wrong.  Receipt showed items that I hadn’t chosen.  Again the written preview showed exactly what I had ordered before I checked out.  How did it get changed?   How does this happen?  I am now in the twilight zone.  What a mess, soooooooo frustrating!!!

All I wanted was a sandwich!",Bad app,1,False,,Subway
132,2021-10-15 18:14:08,kHasemann,"I have no problems with the app in general, but I mostly order the chicken bacon ranch. If I do so through the app, I always get a sandwich without any ranch and it’s not even something that comes up on the “sauces” section or anywhere else in the app! If I’m not ordering for other people at work, I avoid the app, and when I am ordering food for myself and coworkers, I make sure to call the store I placed the order at and explain to the staff that eventually answers the phone (sometimes after several calls) that I want ranch on my sandwich. It’s hit and miss if I actually get ranch on my chicken bacon RANCH sandwich that I receive, even after I call and ask for it. 
I’ll update my review when the main ingredient that I almost exclusively order is added.
I’ve tried contacting through the subway app itself and haven’t gotten anything in return, so here I am, writing a ****** review hoping someone sees it.",Where’s my ranch?,1,False,,Subway
133,2021-05-17 00:12:42,Full of GRACE!,"Comparatively to the many, many food apps we’re all using now (due to Covid), I  was shocked to see Subway has gotten so many “great” reviews from “non-users” for a VERY poorly designed, inconvenient, inconsistent, cumbersome app!! I have my store picked and set, it still makes me confirm it when I place an order! I can’t add 2 DIFFERENT kinds of meat, or cheese to any custom sandwich! It refreshes itself every time I change ANYTHING!  Really?!! In this day and age of technology this app feels and works VERY antiquated!! And that’s saying something from a almost 60 year old!! 🤣  Subway, pleeeeeease hire someone from one of your competitors who have marvelously smooth, easy to use and understandable apps to completely redesign yours or maybe ask your REAL users or employees!  The employees don’t even use the app here in my town, otherwise they wouldn’t have told me to do something that I can’t even do on your app today!!! 🤪",Accurate Feedback!,1,False,,Subway
134,2020-06-15 19:04:25,billymeetssloth,"First time using the app and it had tons of bugs. Timed out twice trying to log in. Every time I click the order button to pay I get a “cannot read property ‘update’ of undefined”. Looks like a javascript error to me. Only way to place my order was to use Door dash app. I tried calling the store directly from the phone number on google maps, but got a modem line, so that was also needs to be fixed. Very surprised Subway doesn’t have automated integration testing to catch show stopping bugs like the ability to place an order. For any devs who might read this review, I’m unsure of the source of my corrupted state. It’s either that I applied the pop up coupon for the free foot long sub, or, when I first tried to buy my CC was expired, so I updated it, came back and was never able to order. I’m guessing one of those two flows causes that update property to be undefined.",Unable to order because of bugs,1,False,,Subway
135,2020-06-12 18:55:19,Jeral999,"This app I think is pretty good compared to some other ones but it’s got the one worst thing of all, subway is supposed to be Myway and when you try to place an order and customize it with special instructions which the app asks for but then the app will not print it out at the store the special instructions for them to follow so how can I get it my way if it doesn’t print it for them how can you get it your way if it doesn’t print it the app makers need to pull their heads out!! Also the custom instructions only 140 characters long like a tweet and it’s only one what is your order three or four sandwiches everybody wants a little special instructions there should be a special instruction for each sandwich added that one at the final and stay away from this app if you want to make custom sandwiches!!!",Don’t use this if you want to custom sandwich,2,False,,Subway
136,2022-02-27 02:41:36,Deans 35th,"The app used to work fine until recently. Are used to have to sign in maybe every month or so. This was probably for security reasons. I don’t know if there was an update or what, but it’s irritating that every time I login now I have to put in my password. Also there’s a little box that pops up that will ask you if you want to use your rewards. I don’t need a reminder so I always click the little box to not show it again. But when I login next time, there it is. Why asked me if I don’t want to see it again if you’re just gonna show it again. These are the only complaints I have. It’s really nice to get the rewards. I don’t really have any other issues with the app.",Possible update issue,4,False,,Subway
137,2021-03-07 18:20:12,MamaHuza,"This app has a very limited application. If you’re ordering multiples of standard sandwiches then it’s ok, but if you want customization, it’s quicker just to order from the drive thru. 

It won’t let you change the bread, it doesn’t include special instructions for each item only for the order as a whole. You can’t view menu items unless you enter the order process. Exiting a menu item in the order process is difficult and sometimes takes you out of app completely, so if you change your mind you sometimes have to start over. If the store is closed, you can’t enter the order process to even view the menu (no planning ahead). We spent over half an hour trying to order 5 subs and in the end, just decided to order in the drive thru. App is a waste of time.",Not good for custom sandwiches - time waster,2,False,,Subway
138,2018-07-27 01:45:40,erod550,"I did my first online order today and on the way to the store I get a call that they have no meatballs. I say ok just cancel the order and I’ll go to a different store. They say we can’t do that, you have to do it in the app. App specifically states to contact the restaurant. I was already there so I went in and stood around for 10 minutes while they tried to figure out how to cancel the order and they never did figure out how. Turns out they did have meatballs they just forgot to thaw them so I had to wait another 15 minutes for the meatballs to thaw since I was already out my $18. Worst Subway experience I’ve ever had and I’ll never order online again. If they could have just canceled the order or even better transfer it to a store that knows what they’re doing with their inventory then it wouldn’t have been that big of a deal to just drive a couple miles to a different store.",Better hope your store has everything you ordered,1,False,"{'id': 4428612, 'body': 'We apologize for any inconvenience this caused. Please contact us at (833)-778-2929 or appfeedback@subway.com. so that we can make this right! Please mention your concerns, the restaurant location, and your user name while contacting us. We look forward to hearing from you.', 'modified': '2018-07-27T18:57:09Z'}",Subway
139,2021-08-03 19:51:08,N810dahood,"I ordered a salad today with avocado slices. Did I get that? Nope. Only realized it once I sat down to eat back at work. No way for me to get back that extra money I spent on this either. Thanks, Subway.

And how do you pick up your food? Well you can do curbside or in store.

If you do curbside during lunch hour, just know that you’ll be waiting a while because Subway doesn’t have a lot of people on staff to actually carry out this implementation. You’ll more than likely need to step out and go into the store. It’s not an inconvenience for me, but thankfully I’m not disabled or really in need of this.

The in store pickup is just as bad though. There is no formal way to do it. Customers standing in line won’t let you through because they feel like you’re cutting in line and the people behind the counter are busy taking care of customers in line. No formal line made to indicate where to pick up. No designated area set aside so customers can just come in and grab their food once it’s ready.

Awful and poor implementation. And this app has been out for a while and other restaurants that just started doing this are doing this a million times better.

Last time I’m using this app. Got screwed out of my money and what I wanted for lunch and felt awful when going in to pick it up.",Awful implementation,1,False,,Subway
140,2020-05-09 14:14:25,Dkac,"I ordered a sub buy one get one free. Unfortunately being new to this app I accidentally said done after the first sub. I went back and added the second-order but was charged for both however I only picked up two subs so I paid full price.  Understand each app is different but most apps you add to the cart then continue with the order processing adding additional items. If they do it differently they should put a warning "" are you sure you are finished adding items to your cart if so press continue if not press cancel and menu to add additional items. ALL SALES ARE FINAL "" this one little thing would get the app a 4-star review from me.",Needs improvement,5,False,,Subway
141,2018-08-09 01:25:03,Fjordhjofd,"I will NEVER AGAIN stand in line at a Subway store.  The App is VERY EASY to use from the first second you click the ‘order’ button.  Regardless of how many customers are in line at the store ordering Subway has ALWAYS had mine done at the promised time.  You just walk up, tell them your name and then they hand you your bag and you leave since you already paid online.  I will NEVER AGAIN wait in line to order a sandwich from someone who mumbles, and has English for a second or third language (90% of them) and talks very low where I have to say (“excuse me”) every single time they ask me a question about my sandwich!!!! I’ve always loved Subway and because of this app, I can eat it more often now. LOVE, LOVE LOVE LOVE LOVE LOVE LOVE LOVE THIS APP!!!",App ordering,5,False,,Subway
142,2019-08-29 21:59:31,C-A-R,"Favorites can only be saved after an order has been submitted.  Favorites can’t be revised and saved, or deleted.  Sometimes certain details in the last order, or Favorite, change —for example, the type of bread defaults back to Italian when it was Italian herbs and cheese.  The order tickets in the restaurant do not print out fully detailed.  I have often had my order made incorrectly because I order a sandwich entitled “egg and cheese sub” and I remove the cheese. The employees think there’s supposed to be cheese because it doesn’t read “no cheese” on the ticket.  Or I had “Guacamole on the side” on my previous order, and I see it in the remarks on my repeat order but it doesn’t print out on the ticket in the restaurant so they put the guacamole on the sandwich.  There need to be some serious adjustments made to this app.",Seriously flawed,3,False,"{'id': 10538366, 'body': 'We apologize for any inconvenience this caused. Please contact us by tapping ""Contact Us"" in the app menu, at (833)-778-2929 or by email at appfeedback@subway.com- so that we can make this right! Please mention your concerns, the restaurant location, and your user name while contacting us. We look forward to hearing from you. \r\n', 'modified': '2019-09-05T16:04:58Z'}",Subway
143,2020-08-02 18:55:57,piggiesrcold,"I think the Subway app is really great for ordering. You get to pick your time to get your sandwiches and the menu is easy to use especially the way they show the layering of condiments-very cool. My issue is with finding the Cheese, Veggie, Sauces, Seasoning button. The little downward arrow is up in the right hand corner and you’re not sure to touch it or not-This should be larger. My other issue is the fact that Apple Cash crash landed on me to where it looked like I was going to cancel because it looks like the only way to pay. I almost cancelled. Finally when I looked again I saw the ADD PAYMENT METHOD. If these issues gets fixed then the app is Perfect! TY",Subway New App,5,False,,Subway
144,2021-08-31 23:26:25,KC1974,"Don’t order delivery on this. Ever. If there’s anything wrong with the delivery order, the place that made it won’t pick up the phone, and there’s no way to rectify it other than physically go to the store (which didn’t work anyway). Ordered 3 subs: a chicken teriyaki and two Philly cheesesteaks. Received a chicken teriyaki (minus the chicken) and a separate bread stick. The receipt showed what I ordered. Called multiple times - it went to a voicemail inbox. Tried calling Subway as there’s nothing in the app. They’ve gone 100% digital (ie they ignore you). Filled out the survey about the form. Zero response. Went to the store with what I received and was told that wasn’t what they packaged up… so was accused of lying.. Ended up charging it back though my credit card. So while this app is ok, customer service is nonexistent, and don’t get delivery as you can’t do anything about it if they mess up.",Warning - Zero Customer Service,1,False,,Subway
145,2021-04-20 12:08:54,PMCBCfs,"So I’ve had the Subway app for several years now with varying luck, usage and satisfaction.  Being able to pay with the app has always been a struggle for the employees and it has not been user friendly.  Recently it took a turn for the better, my app is carrying a balance, I have a “favorite” sub that I order, pay and pick up with a couple clicks!  I went to show my wife how the app has gotten better and it asked me to update the app before opening which I did.  Now.... I can’t even open the app!!!!!  I’ve deleted it and reloaded, nothin and now my “new favorite app” is use less and I’m back to where I was two years ago!!!  Hey subway, I think it’s time to hire someone in IT that isn’t a relative!!",Seriously?!?!?!,4,False,,Subway
