,date,userName,review,title,rating,isEdited,developerResponse,Company_name
0,2020-12-05 19:09:04,Godspeed2302,"I used this app a lot for the rewards program, and now I use the mobile ordering even more since COVID restrictions in my town. You can select all items from the menu and indicate the specific bread, meat, toppings and sauces. I love how you can even indicate whether you want the regular amount or if you’d rather have more of a topping or less of the amount. You can also add on “ make it a meal” or side items individually. It is great that after you make an item you can select it as a favorite and put a name on it. This makes it easier the next time you are ordering for a family you just go to your favorites and you can find all your items already built to suit for each person. Additionally, you automatically earn points toward your reward tokens with later turn into cash rewards toward your purchase. The only downside the the rewards is that they do expire so don’t forget to use them. Last perk...well you can skip the line of course. It indicates what time your order will be ready and you can skip the line and go to the register to pick it up. Your all done because you already payed online. Great app!",Convinient and has rewards,5,False,,Subway
1,2020-12-13 22:54:17,csfrost1986,"Especially compared to the competition (places like Taco Bell, Sonic, Pizza Hut, and Starbucks, which all have excellent apps), I find this app to be buggy and inconvenient. Adding toppings and sauces to subs is more cumbersome than it should be and I usually experience a lag when trying to remove toppings. The options online often don’t match up with the store. Salt apparently isn’t an option using the app, although pepper is? Maybe the issues lie with my local Subway’s inventory, but I also can’t select chip options that I know they have in store. There’s no way to specify what kind of fountain drink you want if you add it as a stand-alone item (can only specify if it’s part of a meal). As a result, I have to use the special request section to correct my order since it isn’t accurate and even then I just end up having to grab everything myself when I get to the store. Also, ‘Make it a meal?’ shows up for subs but not for personal pizzas, even though every Subway I’ve ever gone to offers up the option of making my pizza a meal. Had to try adding my credit card about 4 times before it finally saved it (even though I didn’t change any info  from the first attempt to the last... it was just being buggy). Buggy and slow when trying to remove items from the cart. Finally, it’s probably human error somewhere in the process, but the tracker often won’t register that I’ve picked up my order, so I’ll see a reminder on the app homepage saying I have an order ready.",Not great...,2,False,,Subway
2,2021-12-31 01:22:42,Maxswiggy,"So I already had problems from the start of my desire to order my subway sandwiches from one store for curbside pickup and was told when I called there that they had to cancel my order because Covid showed up with two of their staff and they couldn’t give me my order. I totally get that and was sorry to hear they were affected and pray they’ll get through it unscathed. So I asked if they could forward it to another store and they said know. So I placed an order at another store on my way home. When I got there there was no one in the store and the young man started my order from what I could tell and completed it and put it to the side because a family walked in along with a female employee. I’m in parking lot watching this. So she joins him to help with family order but I’m wanted to get going tsp I called to ask about my order and she answered the phone. I told her I was ready for my order to pickup. She said, “Just wait a hot minute” and proceeded to hang up on me. I feel I had ordered way before the family walked in and should have mine completed and delivered first before starting in another. Then I get home and my sandwiches were not prepared according to what I had ordered. Very disappointed. Don’t appreciate the disrespect either. I was nice when I called, didn’t deserve it. Won’t go there again!",“Just wait a hot minute” says the girl who…,3,False,,Subway
3,2020-04-16 01:15:27,MJSinNEW,"Placed an order at 5:20pm on the app for pickup at the Menominee, MI Subway. Completed the transaction and it told me it would be ready for pickup at 8:20pm. Three hours?!!! Called the store 20 minutes later to see if was really going to take that long. They haven’t gotten the order! She said it usually takes 15 minutes for the store to receive it. So they should have already gotten it. She said once they received the order that they would have it ready in 15-20 minutes. I called back in 25 minutes and they still hadn’t received the order! She asked me to give her my order over the phone and they would make it right away. I went to the store 20 minutes later and showed the woman my phone with the order details which show date, time, order number, store number, location, items ordered, amount paid, method of payment. Everything to prove it’s legit. I appreciate the employees willingness to resolve things, but the app is COMPLETE GARBAGE!!! The store had no way to look up my order, no way to cancel the order, and no familiarity with the app itself. They made my verbal order with one error, by forgetting to put bacon on my steak & bacon sub, which is a little frustrating. The app far outweighed the missing bacon in terms of visceral frustration. And on the Subway website under the Contact Us section, you don’t have an option to choose app problems or feedback. I’d rate the app zero stars if that was an option.",Absolute Garbage,1,False,,Subway
4,2020-08-28 05:28:40,Liam Allen,"The app in itself is pretty good save the fact that it’s not crystal clear how to apply the deals to an existing order. However that’s not the reason why I’m writing to you. I just downloaded the subway app about a week ago, and I have used it four times so far. The first THREE orders had missing items and not just simple items I mean like the missing guacamole in the turkey bacon GUAC wrap. 🤦‍♂️ luckily we live in walking distance so I just walk back to fix the order. Now the fourth time is the kicker and it is pretty much the sole reason why I will never ever use your subway app again. I dialed in the order and it gives me the ready time of approx. 15 minutes. Totally fine. I show up at the approx. time and it’s one person who just showed up to their shift for that night and has no idea where my order is. He spots the ticket order on the counter and is confused why no one has taken care of it since it’s been 15-20 minutes since that ticket order has been ordered and PAID through your app. Apparently your (probably way underpaid minimum waged) prior shift employee grabbed the ticket, set it on the counter, and clocked out without even communicating to the next shift employee about it. I’m giving your app a one star not because your app is insufficient but because you failed to realize that you expect your franchise to employ competent persons to execute orders that is generally meticulous in nature.",Absolute waste of time of an app,1,False,,Subway
5,2021-06-21 04:23:53,Keely Maltby,"I just signed up and it was pretty painless. I’m typically very frustrated by the time I’m finished unless I Chuck my Phone out the window before I’m done.   The application/ sign up process was  easy. Ordering sandwiches was a step by step process and the pictures make it easy to follow. I forgot to order my choice of cheese but in the checkout yiu have one last chance to add or subtract items. Also the locations chapter was easy to follow and subway allows Apple Maps so I’m not forced to download another map app I don’t necessarily want, thanks for that consideration. To summarize; my lengthy review; signing up is breeze  just read the instructions & follow the steps. If you’re not on your own turf Locating a store is a cinch if you know where you are. If you don’t know where you are it’s likely you need more than a sandwich.  I found this app to be problem free. Besides there really isn’t a Cadillac problem that can’t be fixed with a stomach full of Subway is there?  Slow your roll (wheat , Italian, or artisan lol couldn’t help it ) slow your roll you’ll be unwrapping that delicious 12 inches of Yummy in no time. Cant eat the whole thing? Wrap in some plastic and BAM! Lunch tomorrow cuz its stays fresh even overnight. You’re welcome,  k&g Henson Murrieta Ca",A beginner,4,False,,Subway
6,2021-04-16 03:51:27,Gottliebfan,"Are used this app about three days ago and it worked fine. I was able to go to my recent orders and replace the same order without any problems. Then I upgraded the app. When I tried to use it today I was unable to re-order one of my orders from previous days. I had to start an order from scratch. When I got to the subway restaurant about 20 minutes after placing my order, they could not find my order then they found his body had a hard time because they did not find my name on the order even though I had placed the order using my Subway account with my name on it. Now I am trying to test the app again and I get a screen that says I need to update it when I press the green update button at the bottom of the screen nothing happens. I went to the App Store to download the update but I am having the same problem. When I open the app, I get that same screen that says that an update is needed and it’s giving me an option to press the green buttonTo update, but that button is unresponsive. What is happening?",Very buggy,5,False,,Subway
7,2021-08-03 23:53:40,B3x3,"I placed an app order at my local Subway Sunday evening at 8:40pm. Store hours online said they were open until 9pm and the app showed them available for taking orders. Placed an order and got a message from the app saying my card was charged, the order was confirmed and would be ready shortly. I went to the location (verified twice) and the store hours on the door said they closed at 8. No big deal, hours change, but then why did the app allow the order, confirm, and charge for it? 

So, I went in to the store today, showed them the order (which the app still lists as pending),  explained the issue, figuring since the order was shown as paid, they could simply make good on it now. I was told that they couldn’t make food for that order, that I would have to order again and dispute the previous charge with my bank!!  I just did and got my money back, thankfully. 

I also tried contacting Subway directly before my bank, but their 800 number would only tell me (by recording) to report app issues on the web site. Clicking “help” in the app takes you to that same site, and the answer to “how to report an issue” on the site says to click “contact us” under “help” in the app, but no such option exists. There’s literally only “help” which takes you to the web site which says to report in the app……..",Useless app and terrible customer service,1,False,,Subway
8,2019-10-03 16:02:24,Anita245,"I would give a 0 star rating if I could. The app wouldn’t was not working at all about 1 month ago while visiting one of my local Subways to pick up a sandwich at the end of a long day! The clerk/server ringing up my purchase did his best to scan the App to apply/redeem my points to no avail. As I happen to carry the card that came before the App with me as well, he tried to swipe the card (which has always worked before) and the end results was a total lockout of my account with the message to contact Subway. I had to make the purchase without my points! I did contact Subway the next day and after several minutes, the customer service rep found the solution to my problem. Problem solved; hardly! Two weeks later, I went to buy three sandwiches at one of my local Subway locations. This time out, the App just kept spinning and spinning as if it was prepping to open. It never did! Thank goodness my old card worked this time out. A couple of days after, I tried to open the App at home just to see what would happen. It opened up without a hiccup. Gee Subway, I need the App to work when I am actually interested in ordering food, NOT when I am just sitting at home not interested in eating your food that day. I expect to have a helpful, functioning App at the time of purchase instead of a message to contact you guys, or to simply not have the App open at the moment of truth! Frustrating!!!!",Simply doesn’t work!,1,False,"{'id': 11151738, 'body': 'Hey, there- we\'re working every day to improve the app experience and we wanted you to know that this issue (the ""spinning issue"") should now be resolved (with version 15.2.0). If you have further difficulty, we are always here to help at (833)-778-2929, by tapping \'Contact Us\' in the App Menu, or via email at appfeedback@subway.com. Thanks!', 'modified': '2019-10-09T15:35:39Z'}",Subway
9,2018-02-08 22:34:52,Ronwilt,"The app is convenient when it works.  I say that because so often I go through the pains of buying online and I get to the end and get an error. This happens frequently. I resubmit, start over , etc. same stupid error message. And there is no one to call and ask for assistance. I keep the app current on my iPhone. The next day it may or may not work again. I also think going through the menu is slow and clumsy. 

I also try to get my order straight in advance so when I am ready and I hit the purchase button I know it will be fresh. This is typically the time I am hurried and do not want to step through the menu. But I still want Subway Fresh, right. But today something changed and when I went back to my order to submit payment it appeared to be missing. So I ordered all over again and then noticed I had two subs in the queue. So I had to figure out how to cancel one of them. My order changed slightly and I couldn’t tell which one I was canceling. 

So what is my reward for continuing to use the app and buy from Subway. There is none. No rewards for buying your subs 3-4 days a week. No extra discounts. No buy 4 get the 5th free. Nada. And I don’t expect anyone will respond to my input. So Surprise me, Subway.",Where’s the Rewards,4,False,"{'id': 2576223, 'body': 'Hi there- we are here to help! Please contact our support team at (833)-778-2929, or by email at appfeedback@subway.com. Have your app version, device type, and the steps to reproduce any errors ready- so we can investigate and address these concerns for you. Thank You!', 'modified': '2018-02-13T21:10:05Z'}",Subway
10,2022-01-06 16:24:03,DO NOT GET TERRIBLE TO DELETE,"First I placed an ordered for delivery. Upon arrival I received one out of three sandwiches and the one I did get wasn’t correct at all. I looked to see if there was a way I could fix this through the app and there wasn’t. This was the beginning of my problems. I then called the store as directed by their page and was met with the most rude and incompetent person. She refused to cancel it/refund it saying there was nothing she could do. When I asked for a customer support number she said she didn’t know, when I ask okay how do we fix this? She stated in the most annoyed tone “I don’t know, I can’t do anything” when I asked for a manager she said I kid you not, “oh I don’t know” are you serious? When asked for her NAME she said she didn’t know. Eventually I just hung up and was going to dispute it with my bank but she did call me back and suddenly was magically able to cancel the order. The second time I attempted to use the app, I placed an order on the app for pick up this time attempting to avoid the same issue, the order stated it went through and they where “working” on it. However when I arrived the place was completely empty and closed!!! Not a single employee in there. How the app allowed me to place an order is beyond me. I had to dispute the charge with my bank since I couldn’t even call and corporate is a joke. Over all screw subway, NEVER AGAIN.",THIEF’S NEVER AGAIN!!,1,False,,Subway
11,2022-01-06 21:21:45,Mahler rocks,"I placed my order in the app but when it came time to pay the app gave me an error message and asked me to try again. I did so. Then it gave me another error and said my cart had expired, create a new cart. I closed the app, relaunched the app, tried again and had the same problems. I finally gave up and called the store directly. After placing my order over the phone, I thought to check my email. Sure enough, there were two messages waiting for me confirming my orders from the app. I checked with my bank app and guess what? Subway had charged me three times! Two times from the app and once from the over the phone order. 

As I was looking at this information, the store called me back. Thankfully they noticed a duplicate order. What’s that you say? A single duplicate order? That’s right… Only two of the three orders showed in their system. Some thing was definitely not working right. The store was only able to cancel one order and is going to wait an hour or two to see if the third one shows up in their system and will void it at that time. 

What a horribly, unreliable app. And for people who don’t catch the extra charges on their bank account right away, a horrible inconvenience to have to call the bank and try to prove that these charges should not have existed in the first place.",App crashed but still charged me,1,False,,Subway
12,2021-01-25 21:53:51,Shadows14,"I am unable to order from any of the Subways around me using this app. I can only use it for the subway by my brother’s house. Also every time I order extra sauce it comes as light sauce. I originally thought this was a worker error, but it happened for months on end. I finally switched to ordering the regular amount of sauce and I get way more sauce now(still not heavy unfortunately.) I have also had several instances of ordering the buffalo chicken sub, but buffalo sauce is not an option so it came as plain chicken even though I paid more for buffalo. Despite my complaints Subway is absolutely delicious and it’s awesome to order through your phone instead of in store. I would order far more often if the Subways by my house were compatible(I can’t understand why they aren’t). I also once had an order that never made it to the restaurant which caused a series of inconveniences that ended with me spending over an hour in the store and eventually ordering manually. The inexperienced worker was very understanding about it despite how slow he was and slammed the restaurant was. He tried to call the manager for help who did not answer. Why the manager left a new kid all alone for a rush was beyond me.",Good app for the most part,3,True,"{'id': 4783493, 'body': 'Hi there- we are here to help! Please contact our support team at (833)-778-2929, or by email at appfeedback@subway.com. Have your app version, device type, and the steps to reproduce any errors ready- so we can investigate and address these concerns for you. Thank You!', 'modified': '2021-01-25T21:53:51Z'}",Subway
13,2020-07-31 16:37:06,Akominiarek,"I ordered and picked up an order though this app on 7/23 and didn’t seem to have any issues. Two hours later, the store called me to tel me that my order needed to be picked up! I had already done so! Much to my chagrin, there was a different order - two sandwiches instead of the three I ordered. I thought it would be simple and the store would cancel the order - NOPE!!! The manager said they didn’t get any money for the sandwiches and they could not stop the pending charges or reverse them so I would have to submit an online request for reimbursement because I used this app - but wait it gets better - I submitted my request that day and waited patiently for a response, but on the eighth day I called corporate. Corporate told me that they would do anything for me either and I had to take the time to dispute the charge with my own bank:/! I was told this subway is a franchise and therefore not part of the subway corporation?!?!?! Best part is I’m the only on that is out of luck - the franchise and the corporation still have my money!!!! The lack of support and customer service has been appalling. I have now spent my time disputing this charge with my bank. Subway you have really dropped the ball on something that could have been so easy to correct ON YOUR END! BEWARE OF USING THIS APP! Shame on your practices Subway.",Wish I could rate a zero,1,False,,Subway
14,2020-08-23 20:26:42,jessxxxxxxxxx,"I don’t know what’s up with this app but it keeps changing my name to my husband’s name but as soon as I go under account and click on ‘name’ it clearly shows my name then changes the name back to mine.  It caused a problem today when I ordered online for pickup. My husband went to pick it up and they claimed it didn’t go through. Then I go in and show them the order number and they claim it was never received by them and they suggested I reorder in person and pay again. Upset, I leave. Upon getting home, the app shows my order is ready for pickup so I call the store again.  They claim they still hadn’t received the order and that it must be an automated notification.  Three hours later I receive a call from said subway asking if I am going to pick up my order as it has been hours since it was ordered online. I tell the person they must be joking because I was there hours before trying to pick it up when they said it didn’t exist. It was apparently under my husband’s name somehow.  You would think they would have asked my husband if it could have been ordered under his name somehow but neither of us even thought about that. You would also think when she asked me for my order number something would have showed up in their system.  Worst experience ever.",Horrible app,1,False,,Subway
15,2018-01-09 05:03:57,Boo!!!!!,"I'm not one to write reviews but This is getting old... This app is still terrible even after the updates. Twice now I have attempted to order and it says ""something went wrong please erase your cart and try again"" or something like that. One time I completely gave up and went somewhere else only to get a call asking if I was coming to pick it up. The staff was nice enough to keep it on record as an I owe you and redeemed that later. Another time I tried a second time to get the order to go through as the directions stated and when I went in to just order it the normal way they stated the order went through twice and one ticket had 3 meals ordered. I only told it to order one meal a time.. Get this SH@$ working already.. This is going on over a year for Subway having an epic failure of an app. Keep saying they fixed it with every update... Do you even use our test the app? Someone isn't doing there job right. I'd feel pretty miserable if I was in charge of application development! Hope they're getting paid well for nothing! Almost every other food ordering app from other places has a 4 plus most over 4.5 plus rating... I think it's time you take a look at how they are doing it. Maybe throw up the white flag and call for help.. You literally have nothing to lose. Rant over.",Says failed when my order actually went!,1,False,"{'id': 2265107, 'body': 'Hi there- please contact our support team at (800)-888-4848, or by email at appfeedback@subway.com. Have your app version, device type, and the steps to reproduce any errors ready- so we can investigate and address these concerns for you. Thank You.', 'modified': '2018-01-10T19:31:19Z'}",Subway
16,2020-07-27 20:55:11,jacksonti9398,"I’m a big fan of eating at Subway because of how much you can customize things. This app doesn’t let you do that nearly as much. Items like the Steak & Cheese don’t give you the option to select a Footlong, which is frustrating because Subway currently has an offer of $5 footlongs if you order 2 on the app, which this prevents me from taking advantage of. Entire menu items are completely missing from the menu as well, like the Ham and Turkey sandwich. Also, other ingredients, such as bell peppers, are completely missing from the Customization page; but when I go into the local store in-person, they have them in stock. 

I also sometimes like to add other meats to existing menu items, but the app only allows Pepperoni, Bacon, or Guacamole as custom add-ons. I know from working at a Subway restaurant in the past that it is just as easy to add items like Salami, or almost anything else, onto an order; yet the app doesn’t allow that.

All in all, these issues with this app have prevented me from being able to order what I want from Subway via app. The Subway website has all the same problems. During this pandemic, that means I cannot order from Subway at all.",Disappointing,2,False,,Subway
