,date,isEdited,review,userName,developerResponse,rating,title,Company_name
49,2021-07-15 06:07:02,False,"It’s really annoying that you can’t be logged in to your account on multiple devices. I know I’m in the minority, but I have two mobile phones. One is a personal phone and the other is my work line. Every time you log in to your account on one phone, it automatically logs you out of the other phone. Every time you log back in, you have to verify your identity with a link McDonalds sends to your registered email address. I understand the security but I don’t understand not being able to use multiple devices.  

My wife wanted to order something when she was out the other day but she couldn’t use our account because the email verification was sent to my email address and she couldn’t get the link on her phone. I seriously don’t understand the point of having an account that is tied to a single device.   

The biggest issue is that you can’t order ahead. You can’t place an order until you are physically near the McDonalds location. They won’t start making your food until you arrive and let them know you are there. At this point, it’s just as easy to go into the store or just do drive-thru. Outside of the deals, it really isn’t a useful app.",RandomEarthling,,2,Nightmare if using multiple devices and no ordering ahead.,McDonalds
50,2020-10-11 23:17:43,False,"I downloaded this app because I was tired of the drive-thru getting my order wrong. I figured, if the order was written down and there to read the order would be difficult to mess up. This was not the case. My first order on the app was a customized quarter pounder meal in which every bit of the customization was exactly opposite. I figured first time hiccups. Next go, I placed my order arrived at the store and selected curbside on the app, parked in the #4 spot, and entered my parking spot number in the app. Up popped and acknowledgement that the info had been received and my order was being made. App notifies you that it usually takes five minutes to get your order. 20 minutes later I decided to go back through the drive-thru line (dining room closed) where I learn they never bothered to make my order. 5 minutes later I have my order minus drink and fries. Two minutes later I have everything but my last large fry and a milk for my happy meal. I got the fry and decided to cut my losses without the milk. If the training isn’t sufficient to employ the technology at a specific outlet; please don’t roll it out. I’ll take my chances with the drive-thru until I can ween my children of of McDonald’s and over to the chicken place. They’ll be going cold turkey soon.",jrmatthews1908,"{'id': 18527801, 'body': ""We're really sorry you were disappointed, Matthew. Can you provide some more info in this link https://www.mcdonalds.com/us/en-us/contact-us/restaurant-feedback.html/ so we can look into this further?"", 'modified': '2020-10-16T15:42:16Z'}",1,Service has to be part of the app functionality,McDonalds
51,2020-09-18 00:32:32,True,"Waited 20 minutes. 4 other people ordered and got served before me. Ask and still didn’t get order. Ine more people served and I asked to get my money back then I was given order.

I ordered on the app in my car then walked in to pickup order. Went into bathroom first then came out to the pickup order counter. My order was not there. Three people were waiting in line to place their order. All three ordered and started to wait for their orders along with me. First one of them got their order, then the second. After that I asked the counter person about my order. I showed him my order number on my phone. He then walked and looked up at what I guess was a screen showing orders. He then left and went to take a order from another person that came in. After taking this person order he walked over and picked up the third persons order. This left me and the last person that came in waiting for our orders. After a few minutes he handed the order to the last person that came it. At this point I said can I at least get my money back! He then walked over pickup up my chicken sandwich and apple pie, put them in a bag and handed it to me and walked away. Never said a word to me. I just left and as I was getting back into my car the review screen popped up and I entered my first bad review.",tonzing,"{'id': 17937308, 'body': 'Hi there. It sounds like this visit wasn’t quite up to speed. Please provide some more info in this link https://www.mcdonalds.com/us/en-us/contact-us/restaurant-feedback.html/ so we can address this. Thanks!', 'modified': '2020-09-18T00:32:32Z'}",1,Bad service,McDonalds
52,2022-03-17 02:02:20,False,"While the convenience of mobile ordering and the consistent deals are amazing. There is much to be desired when it comes to point redemption and the app connecting with the store. There has been at least 3 times where I have ordered something on the app and when I arrive to the restaurant they simply state we don’t have that item right now. They don’t offer any refund or substitution that’s simply all they say. Then I have to reach out to customer service myself to get a refund (the one time I did it) the other two times the order was less than 5 dollars so I just let it be. 

Also how limited the options are for redeeming points is ridiculous! It is simple to give every item on the menu a point value and also I should be able to use as many of the points that I have earned from spending money as I want in one order. I should NOT be limited to only one. That makes no sense once so ever when I spent the money to earn the points! If I have saved 20,000 points that’s my prerogative I shouldn’t be penalized for being a frequent customer I should be able to create and use those points on whatever I please off the menu.",lmnopasif,"{'id': 28656412, 'body': 'we aim to make the best app we can for you. help us get there by replying here: https://www.mcdonalds.com/us/en-us/contact-us/mobile-app-questions.html    \r\n', 'modified': '2022-03-18T17:45:17Z'}",3,Loyalty points are useless,McDonalds
53,2019-01-12 02:44:39,False,"If I go out of my way to download the app, it should be more convenient and saves time, but instead is a bigger hassle than ordering with the cashier. However, there are a couple of refinements that'll bring this up to 5 stars:

1: If I star a location, please use that as a default; the location chooser should have it as a drop-down menu of nearest store, starred store, and perhaps a ""other"" option at the bottom instead of showing the closest location and bringing up the map when you click on it... I get that you choose the geographically closer store, but it's out of my way, but I want the store that is 0.1 miles further but en route of my commute. In its current state, it's actually more tedious to select your starred restaurant.

2. I've emailed about it before; if I've gone through the hassle of mobile order, one perk should be that the food is ready by the time I walk in, especially if my end goal is to not have to wait. However, if I have to order ahead, then check in and wait (I can't check in from home a mile down the street), there is no incentive for me to actually order with the app since it's actually faster to place the order with the cashier.",EdWaRdW818,"{'id': 6909231, 'body': ""Hello, Edward! Our goal is to make sure our customers enjoy using our app and your feedback will help us understand how we can improve it for our customers. We are continuously working to improve our McDonald's Global Mobile App."", 'modified': '2019-01-19T00:08:24Z'}",3,Changing restaurant locations + advance order,McDonalds
54,2021-12-20 05:48:55,False,"Came here last night as well and everything went wrong. First of all they forgot half of the order, so I had to go into the restaurant (AND without a mask as I did not plan on going in) because I walked up to drive through and they told me to come in. So I go inside meanwhile carrying my son’s ice cream cone that was melting all over and garbage at that point pretty much… So she said she’ll get me a new one and throws the ice cream cone away and gets me my fries and the right sauce since I got that wrong to you for the nuggets….And I also ordered extra salt on every item that I ordered so they would hopefully remember to put salt packets in with the order so when I was inside having to get my order I asked them specifically if they remembered and put the salt in the first bag of food and they reassured me yes they did. So I leave, and of course they did not put salt in, and all the first food was of course COLD by then… but the worst part! I ordered 2 large fries and they barely out any in! Which happens ALL the time. And as expensive as the fries are… I expect them to at LEAST BE FULL ☹️ I was able to literally dump the two larges together and it made ONE large fry. Not two. So disappointing. Hopefully today is better. Otherwise it’s not worth the money that we don’t have. We rarely are able to even eat out.",Ashleigh J Cody,"{'id': 26974353, 'body': ""That's definitely not the type of experience we want for you, Ashleigh! Let's talk here: https://www.mcdonalds.com/us/en-us/contact-us/restaurant-feedback.html/"", 'modified': '2021-12-21T15:20:09Z'}",1,Unfortunate.,McDonalds
55,2021-09-18 20:37:06,False,Was not very happy with service. This store always has issues today I tried curbside. All my food was not there the large fries were only half full and there was no straws for our drinks. Young man who brought it out said he would get someone out to help me  it took them 20 minutes to bring the rest of my food to me and the rest of our food was cold. What happened to your drive thru service whenever you go there they almost always want you to pull front and the people behind you in line gets their food first cause they give it out as they come out instead first in first out then they have to snoop in each bag to see which order is which then if things aren’t right you have to wait again. When they finally bring my food out and it is still not right. Really frustrating visit. I totally understand being short staff but when all you had to deal with is “drive thru” and online orders it has got to get better. Lines are horrible one day at 2:00 in the after there was 5 cars that pulled to the side most had 1 sack and a drink they said their timers keeps running if we set at window I don’t care about a timer if they would do service right there shouldn’t have to worry about timer and give better service and hotter food. Thanks for your time.,GMA1957,"{'id': 25213114, 'body': ""We want better for our customers! Let's discuss this further at: https://www.mcdonalds.com/us/en-us/contact-us/mobile-app-questions.html"", 'modified': '2021-09-20T17:03:44Z'}",1,Curbside pickup,McDonalds
56,2020-11-15 12:47:11,True,"Update: Stay away from this app and McDonald’s customer service! I’m done! They reach out to you like they want to help and make things right. So you click the link they send and it takes you right back to where you first made your complaint or to call the customer service hotline where no one can help you. They send you in circles and don’t care. They’ve lost me as a customer. 

I was never a huge fan of the McDonald’s app because you can’t pay with gift cards for mobile orders, but I did use it for deals sometimes when I went through the drive thru. I can no longer use the app on my phone as it seems it is no longer compatible. I get an “application initialization critical error occurred.” All customer service could tell me to do was to ensure my phone was up-to-date and I was using the latest version of the app. I told them the first time I called that I did all of that, even deleting the app and re-installing it. It has now been a week, and I still can’t log in. The last customer service email just repeated the same thing they already told me. Unfortunately it doesn’t seem like anyone is able to figure out this issue, and now I have to take my business elsewhere where I can mobile order and pay with gift cards.",Theatre39,"{'id': 18902933, 'body': ""That's not great to hear at all. Please provide our Mobile App team with more info at https://www.mcdonalds.com/us/en-us/contact-us/mobile-app-questions.html, so we can look into this further.\r\n"", 'modified': '2020-11-15T12:47:11Z'}",1,Application Initialization critical error,McDonalds
57,2018-05-24 05:04:27,False,"I’ve had nothing but issues with mobile ordering using the McDonald’s app. First of all it randomly keeps telling me I have internet connection issues when I don’t. Although I don’t know if that is an iOS issue or an app issue. Then it loves taking my money without me getting my food 😠 It’s done this around 3 times now and I’m told by McDonald’s employees to wait for the money to automatically return to my bank account which it never does. The latest time it took my money, I was at the “we see you’re here” alert and it had the normal option to select a pickup. I had to open another app real quick and when I went back to the McDonald’s app, the screen quickly changed to “Thanks for visiting! We hope you enjoyed your experience”. I never got to choose a pickup option and I was charged for the food that I never received. There was no order number either. That is not acceptable! The app should NOT automatically complete transactions for users and it should save the last position it was at and always allow pickup options. Horrible app programming/user experience. The app and systems need a major overhaul. I complained on the McDonald’s website and was asked to help troubleshoot the issue. I shouldn’t need to do that and I’m very tired of always having to help companies troubleshoot their issues.",lopemac,"{'id': 3587125, 'body': ""We're sorry to hear about your experience with Mobile Order & Pay! Please give our McDonald's Mobile App team a call at 877-334-4332, so we can look into this further."", 'modified': '2018-05-24T21:30:55Z'}",1,Mobile ordering stole my money!,McDonalds
58,2020-01-30 19:27:39,False,"I ordered 3 McChicken sandwiches with the mobile app, 2 original, 1 plain. After paying, I went to pick up my order and I was given 3 original sandwiches. I told the person at the counter that one should have been plain, however they said it came through the mobile app as 3 regular sandwiches. I know I ordered the correct items that I wanted. There should be a way to able to check before paying, what you actually ordered instead of being forced to get what is given to you without the option of being able to check first. When I went to contact McDonald’s using the app, during this process it required that I give them the location of the restaurant. As I tried to enter the location of the restaurant, I had to go back and finish putting in my contact information. By going back, the screen was cleared of all my typing and I was forced to start all over again! The anger grew! The app was really screwed up and I swore off McDonald’s because I always order from the mobile app. The mobile app gives deals, price discounts, and other specials which you don’t get when you walk into the restaurant. I am done with McDonald’s! There are too many other fast food places that serve excellent food. I have always given McDonald’s and the McDonald’s app 5 stars. Those days are now over.",sjheyde,"{'id': 13226388, 'body': 'Sorry about your order! To help us improve, please provide the location here: https://www.mcdonalds.com/us/en-us/contact-us/restaurant-feedback.html/', 'modified': '2020-01-31T16:16:55Z'}",1,I Always Loved it until Today!,McDonalds
59,2022-02-28 19:13:39,True,"At the drive-thru, they ask you if you’re using the app, but then they never hear you say “Yes,” so then you sit there awkwardly for several minutes until they say “Please order or leave.” As soon as I tell them I have a mobile order, they panic and tell me they can’t find the order, and offer to take my order again…however I’ve already paid using the app. If they take the order again, they have to charge you a second time. You can’t cancel the order on the mobile app once you’ve told it you’re at the McDonald’s location to pick it up. Since the app shows your order was picked up, you can’t get a refund for your non-existent order. Before they offer the mobile app and start insisting customers use it, they need to make sure their locations’ systems are compatible with it, and TRAIN YOUR EMPLOYEES on it! 
I have reported problems multiple times, and all that ever happens is that I receive a voicemail from a manager, but have never received even an offer of a refund for the multiple orders I’ve had to pay for two or three times. I can’t continue to keep having these problems and reporting them. McDonalds needs to have this figured out by now.

I no longer visit McDonald’s and never will again.",stevbrei,"{'id': 28296511, 'body': ""we don't want to lose you! help us get this addressed here: https://www.mcdonalds.com/us/en-us/contact-us/mobile-app-questions.html"", 'modified': '2022-02-28T19:13:39Z'}",1,McDonald’s locations do not understand how the app works,McDonalds
60,2019-01-11 16:46:04,False,"I am not going to take blows at an app I have only used a small handful of times, so I don’t really have much feedback good or bad. I would, however, like to make a suggestion based on a recent experience I have had. I know most apps are location based, and it makes a lot of sense as to why. With how far along technology is coming, I feel like it would be an absolutely wonderful idea to incorporate the possibility of someone trying to purchase a meal for someone in an entirely different state. Especially with the new online dating world growing to be as popular as it is. I know there is risk to this, as there is risk that someone will order something ridiculous and just drive off. Perhaps offer a pre-paid reservation of some sort, allowing the app holder to pay on the spot and not block access based on location. I’m sure I am not the only person that would appreciate a feature like this. Anyways, thank you for taking the time to read this. I know it may sound a bit redundant or even mundane. It is just something I look forward to in the future.",Nostalgic_Winter,"{'id': 6909162, 'body': ""Hello! Our goal is to make sure our customers enjoy using our app and your feedback will help us understand how we can improve it for our customers. We are continuously working to improve our McDonald's Global Mobile App."", 'modified': '2019-01-18T23:41:44Z'}",5,Food for Thought,McDonalds
61,2021-08-07 20:45:30,True,"Update again: yep, scroll through 5 pages of “isn’t our update app great” only to get stuck on the last page of that with no way to actually access anything within the app. No menu, no orders, nothing! You would think that a company that WANTS YOU TO BUY FROM THEM WOUOD MAKE AN APP RHAT ALLOWS YOU TO BUY FROM THEM—but you would be wrong…so very wrong. 

Update: when it works, it works well. It’s very buggy though, and there are 3 main problems that I can see right now. - Doesn’t always restart after an order is complete. Sometimes I have to manually delete every individual item in order to place a new order because the previous order (which was completed) is still there - Coupons don’t always work. I just tried to use a coupon for the drink that I usually get, and have used successfully in the past, but right now it doesn’t work. Usually the drink comes up in the list for the coupon but for some reason it’s. It listed this time, although it has before and it fits the criteria - Contact Us isn’t working. That’s why I’m posting my complaints here There is no point in having an app that takes up space but doesn’t work. I wrote in about it, for the message that my complaint was received, and nothing after that",Amathamac,"{'id': 3803947, 'body': ""We're sorry about the issues you're experiencing with the app! We’d love to help you with a solution. Please give our McDonald's Mobile App team a call at 877-334-4332, so we can assist you further."", 'modified': '2021-08-07T20:45:30Z'}",1,Downgrading my review from “Meh” to “Completely unusable”,McDonalds
62,2018-12-21 00:20:32,False,"Placed and paid for my order using the mobile app, but when I got to the drive thru was told they had my order but the payment didn’t go through. The app gave no indication that there was a problem with the order but the cashier insisted the payment wasn’t applied. So I gave her my bank card only to find out later I was double charged. I have my bank statement, the original receipt from the cashier and the history log on the app itself. My bank won’t help because this technically wasn’t a “fraudulent purchase” and the McDonald’s customer service line suggested I call or go to the location and speak to a manager. The manager wasn’t there when I called, but someone took a note down with my information. I called customer service again and a report was taken but no resolution yet. While everyone I spoke to was sympathetic and agreed it wasn’t right to pay twice for one order, they weren’t able to resolve the problem. Considering this issue, I’d like to delete my payment information from the app but there doesn’t seem to be a way to do so. This has been frustrating and I don’t see how it benefits McDonald’s to make issues like this so difficult and cumbersome to resolve. I’m not optimistic I’ll get my money back and it’s gonna be hard but I’m not buying another delicious McNugget until I do.",3700 State St.,,1,Nope. Never again.,McDonalds
63,2019-01-24 18:51:57,False,"I was an early adopter of the app and greatly enjoyed the great deals offered.  Deal “value” has greatly decreased, but more importantly, the app value guess sunk to delete level.   The app no longer recognizes my credit card and tells store it is declined via the app.  Weird since all other stores accept it.  So I tried to load another card - no cards are accepted - including corporate cards, visa, MasterCard, credit nor debit.  In short the app rejects all cards deemed functional by other stores as well as the issuing institution - so it isn’t a card issue.  Four McDonalds locations have been tested and they see an app trend where cards are not accepted by the app and must manually run the cards through their system.   So local managed stores recognize an issue, but McD’s app developers seem to miss it.   I’ve seen increase in solutions on the web - turn off WiFi at store, turn on WiFi, delete and reload app, log out, delete app and reload app with new email and card. I’ve tried about everything -even loading my account on another phone, which still doesn’t allow me to use the app.  So it has to be locked up in the app profile info somewhere.  McD App developers need to fix it.  For me for now, I’m done ordering and eating at McD’s.  The app gets deleted today.  
Hello Chick-Fil-a.  Their app works nicely.",App-less at McD's,,1,From great to un-useable,McDonalds
64,2021-04-25 23:56:09,False,"Finally, after eight months, and longer for may others, McDonalds finally fixed their app, which had been completely unusable.  It boggles my mind how a multi-billion dollar company let this issue go on as long as it did.  I, for one, refused to go to McDonalds if I could not order through the app.  Since McDonalds only allows you to use their deals if you use the app, there’s no way I was going to pay more for something knowing it’s cheaper through the app.

Even though the issue is fixed, I’m still leaving my rating at one star for now since this was an issue for so long.  Also because this incident has illustrated just how bad McDonald’s customer support is.  I called and emailed multiple times since the issue started and all they would tell me is that I should make sure I’m using the latest version of the app and iOS and to try uninstalling and reinstalling the app, which of course didn’t work.  One supervisor I spoke to even told me it was an issue with my phone and that I needed to get a new one.  Give me a break.  They clearly knew about this issue but refused to be open about it, instead just blaming the customers.

We’ll see if this fix lasts.  Maybe in a few months if everything is still going well I’ll increase my rating.",Jerome SE,,1,App Finally Fixed,McDonalds
