,date,isEdited,review,userName,developerResponse,rating,title,Company_name
0,2020-04-18 15:23:05,False,"This app is better than most fast food apps when it comes to ease of use, customizing and managing orders.  If I had written this review a year ago, it would have gotten more stars; however, there are some growing issues related to limitations on orders that need to be fixed.

The deals being offered are becoming more complicated and causing more and more problems.  For example, I created an order that declined to process because a deal I was able to apply to my order was no longer being honored at a particular location at a particular time.  This caused me to start over completely, picking another deal that is appropriate to a different order combination.  Then, my new order wouldn’t process because the unhonored deal from my first order stopped me from picking a new deal for 24 hours.  It would be my recommendation to reprogram the app to not record the use of a deal until a purchase has been completed and change the 24 hour policy to 20 hours so that customers that pick up a daily breakfast at a slightly earlier time than the previous day can use another deal.

Reoccurring glitches in payment processing has also been on a rise of late.  Several customers pay with the app and are asked to pay again when going to the drive-up window.  My online banking shows I am billed twice and at the end of the day, one of the two transactions are being credited back.",FamilyMoji Idea,"{'id': 14762247, 'body': ""We're sorry about your experience with Mobile Order & Pay! Please give our McDonald's Mobile App team a call at 877-334-4332, so we can look into this further."", 'modified': '2020-04-19T15:27:51Z'}",5,Glitches to be Fixed,McDonalds
1,2021-12-10 20:01:08,False,"I’m a mega coupon fanatic. Every time I go out I’m always paying for more than one. So coupons have saved my wallet a substantial amount. This app started with a bang. The coupons constantly changed and were always very valuable deals. But with the years passing, I’ve only saw the deals get more and more limited and you’ll only save 50 cent on a 10 dollar order. And when I say limited, I mean it. I’ve had the same coupons for over a year. With very minor changes. But those changes happen every 2-4 months and are gone within a week. The only deal that makes the app worth having anymore is the bogo for 25 cent on the quarter pounders. This one still saves the hole in my pocket. But then I’m limited to eating a quarter pounder anytime I’m at McDonald’s. Which I wouldn’t complain about normally but after a year, it’ll burnout, trust me.  It’s just very disappointing  to see something that was so good turn into something so bad. I very much hope the developers will look into the main aspect of the app a bit more. Till then, if anyone feels the way I do, you can check out the Wendys app. They have incredible deals that change almost weekly. I’m actually on my way to get a burger,fry,drink,chicken nuggets and chili cheese fries. All for the price of one McDonald’s quarter pounder. I hope I can say something similar about the McDonald’s app in the near future.",yelpcertified,,5,This app has lost it’s purpose,McDonalds
2,2020-07-02 13:47:03,False,"I work at a large hospital and walk by McDonalds which is by the entrance to the hospital on my way in.  While in the parking garage I will place an order for two hot mocha McCafes for pick up on my app. I then walk to an area where I get a face mask and have my temperature taken then eneter the building.  This is around 8:00 am.  If I’m lucky someone will be behind the counter to help me.  My order is never ready and I always have to wait for my coffees to be made.  Meanwhile people are coming in behind me placing orders, getting their food and drinks and leaving.  There are also times when I walk into the restaurant and not only is no one behind the counter, no one is anywhere to be found, not even in the food prep area.  I have to call out or shout so someone will come out from a closed door to wait on me.  Then again I have to wait for my coffees to be made.  I got the McDonald's app hoping my order while placed in advance would be ready for me upon arrival.  Not once has it been.  I skip paying since the app has no problem taking my payment.  I wish your service was that efficient!  But it isn’t!  I have found my experiences dissapointing and frustrating!  A waste of time which has caused me on several occasions to be late for work!",Christa@TGH,,5,Terrible service,McDonalds
3,2021-08-11 15:33:01,False,"I recently had to place an order three times because the app timed out when my screen went to sleep. Thankfully it only charged me once. 
I placed the initial order on our way to the restaurant. My screen turned off on the way there after placing the order. When we arrived at the restaurant there was no record of my order in the app. My debit card was recently destroyed so Apple Pay was the only option until my new card came in. So I tried to place the order at the restaurant, but the entire app had timed out meaning I had to log in again. For some reason it wouldn’t log me in. I kept getting error messages. We were in a hurry so I had to leave the restaurant. The app started working again when we got home and since my husband had promised our toddler nuggets, I went back out to get the meal (I really didn’t mind). Since I was having issues ordering at the restaurant, I placed the order at home and then drove over. Again, the order was not on record. Thankfully the entire app didn’t time out and I was able to place the order at the restaurant. Took them 25 minutes to get my food out to the car.
I doubt I will use the app again. It was such a hassle and took so much longer than the drive through or even ordering through door dash. Other stores, like chick fil a, have figured out how to let people place an order before getting to the restaurant. It doesn’t seem like it’d be a difficult thing to do.",Jennysub,,2,Don’t turn your screen off,McDonalds
4,2021-04-16 17:23:43,False,"I don’t even know what more to do about this app... I guess I just won’t ever get to use the daily deals or use a mobile order since it has NEVER worked on my phone. I have an IPhone 12 Pro that has the newest software update and have tried over and over again to delete the app and re download without any success. Even before I got the 12 Pro I had the X and for over a year now I’ve always gotten a message when I tried logging in that said “Critical Error has Occurred, App needs to restart.” I tried logging into an existing account that I had created a few years back and got this message every single time so I tried signing up for a new account and still received this message. I contacted McDonald’s via phone and someone in their IT department said they would “pass along the information to their developers and hopefully with the next update it would be fixed.” Today I tried to re download the app again since it’s $1 fries for mobile users and I thought just maybe today it will work for me... nope! So now when I download the app it just completely crashed and doesn’t even load. I have missed out on so many deals and feel beyond frustrated that I can’t even do a mobile order for pickup. I researched online and other people have had this same issue without getting it resolved. You would think that with McDonald’s being one of the largest corporations in the world that they would have figured out all these bugs and issues by now. So disappointed 😡",Ashhart1020,,1,Unable to Even Use the App,McDonalds
5,2021-09-28 00:13:38,False,"For starters, I’m generally against fast food apps because it’s typically faster to just order it in the drive through but I thought I would give the McDonald’s app a shot since they have some pretty good deals. I just wish this app were designed a little better and the stores were a little better trained for mobile orders. One big problem I have is the unnecessary requirement to share your location. This just feels like a huge violation of privacy and for no gain. They want you to share your location and it actively uses it anytime you even open the app. I can kind of understand it so they can estimate when they need to prepare your order and I believe that is their reason, but; 1) if it already tracks your location why should you have to click in the app that you arrived at the restaurant? 2) since it is a fast food restaurant, most of the time your order should already be ready. I guess the app just guarantees it? The app actively tracks your location, and not request a location like it should if it wants that. The deals are kind of annoying because they cannot be combined and can only be used once per hour. Overall, the app just feels like a way for McDonald’s to steal your information and takes a lot of work to save $1. The app doesn’t even improve the ordering process because some stores will have problems finding your order",$aver of cash,"{'id': 25556930, 'body': 'We want to make the best Mobile App we can. Help us improve on this by replying here: https://www.mcdonalds.com/us/en-us/contact-us/mobile-app-questions.html\r\n', 'modified': '2021-10-07T21:52:33Z'}",2,"Terribly designed app, many stores not fully trained for the app",McDonalds
6,2021-11-09 23:02:37,False,"I’ve been using this app for a couple months now, and it has become increasingly frustrating. Yeah, you gain points quick and there are good deals on there, so overall I would say it’s worth having, but the glitches are too much. For starters, every single time I open my app (unless it’s multiple times in one day) it says I’ve been logged out due to an error, and have to log back in again. It is just a few clicks, but it’s beyond annoying, especially when you’re trying to get food from a fast food restaurant, well, fast. Secondly, there have been countless times I’ve had to completely redo an order because a promo/deal was not longer available at my location…even though it takes me literal minutes to order because most of my stuff is saved. If it was no longer available, why show it as an option? Finally, the stress with workers not wanting to honor deals when I don’t do mobile ordering is terrible. 90% of the time they scan a reward they say it’s not valid, just to have a manager have to come and tell them how to enter it manually because it’s an app issue not a promo issue. I’ve come to use it less and less because saving a couple bucks really isn’t always worth the frustration and work I have to put into something that supposed to streamline and make a process more efficient.",Mrs Thunder 21,,3,"Great in theory, not so much in execution.",McDonalds
7,2021-03-07 17:53:47,False,"The McDonald’s app has been great generally over the years. But when they change it you lose earned rewards. I’ve done so many times, the worst recentlyWhen they changed from my café rewards to the regular McDonald’s rewards. In the past for every five coffee drinks you bought you would get one free. I had bought coffee almost daily on my way to work and hardly ever redeemed them. At one time I had over 28 or 29 mccafé coffee’s to redeem. Even though the expiration date had passed one day I noticed seven or eight of them had disappeared. So I started using them. I built them up again and again and use them here and there. Maybe a month ago I had 22 Mccafé drinks and they change the app again to rewards instead of the café drinks. I checked the app and I were seven showing four or five of which had to be redeemed within a few days or they would disappear/expire. I didn’t have time to use the mall and ended up losing four or five of those. If you figure those drinks run an average of 4 to 5 dollars each and lost a couple hundred dollars and drinks over the years. And I bought a couple hundred coffees  a year from McDonald’s. For many years... this has made me much less trusting of the McDonald’s app.",ajfred3,,5,Beware of changes,McDonalds
8,2021-11-19 19:57:33,True,"It’s mind-boggling how an app is promoted for a fast food joint but yet not have everything on the App Menu as the “restaurant” would. I searched through the app, through the “deals” and it was simply not there. I go to the “restaurant” and it’s available as an option. The two need to be synced for optimal experience for the user. Update (1) - now when you Checkout and state you are at the location for pickup, it wouldn’t allow for me to select an option of how I want to pick up (curbside, drive-thru, etc.). Small item as such needs to be fixed.
Update (2) - now it seems the Meals are “synced” along with the option of how to pick up BUT one outstanding issue still remains - When the location is to make the food. It won’t allow you to do it while on route or close by. Nope. You have to select it while you are in the parking lot of the location. Why is that bad? Because when you select to pick up in store, the food is still not ready. At times, the folks on the line get their food first still. Pickup for Drive-thru…well you would have to wait if there is a long line (still!). “Curbside” - similar issue as pick-up in-store option. Food is not yet ready.

Another main competitor allows for the food to be made ahead of time - when the user selects it. Make that happen and you may just get a 5-star rating. Until then. There are still better apps out there.",B1G82307,"{'id': 10574860, 'body': ""We're sorry to hear about this! We’d love to help you with a solution. Please share more details with our Mobile App team at https://www.mcdonalds.com/us/en-us/contact-us/mobile-app-questions.html. Thanks!"", 'modified': '2021-11-19T19:57:34Z'}",2,“Upgraded” but still far from perfect,McDonalds
9,2018-07-02 03:21:26,False,"Regular updates actually do make improvements to ordering (really glad to see drinks ordered by type in the latest update instead of a ten page long menu of every drink in every size), and the CS team was responsive the one time I contacted them.

The sheer scale of McDonald’s locations almost makes a single app a foolhardy idea, but this one works a lot of the time. When it does, it’s fantastic - I like being able to see what’s on a sandwich and specify no (or extra) of a topping, and the Deals are often really good. I also love being able to park in a curbside spot and wait with my radio and AC, rather than wait in the store or at the drive thru lane.

The problem is the menu in the app, which appears to cover all markets and includes items my local stores don't offer. Sometimes it stops you before you place the order, and other times the order just errors out with no explanation. So be wary of ordering any items you wouldn't see on the store's displayed menu, like Sweet Chili or Szechuan dipping sauces, or the Oreo Frappe, which is in there even though my local stores act like it doesn't exist. (And come on, just make me a Mocha Frappe and sprinkle some Oreo crumbs from the Flurry station in it. It's not like the ice cream machine is working today anyway.)",Britain W.,"{'id': 4110001, 'body': ""We're so excited you feel that way! Thanks for exploring our awesome app!"", 'modified': '2018-07-05T17:38:11Z'}",4,It’s coming along,McDonalds
10,2020-09-03 20:26:14,False,"This started out as a great app, but now,  no longer deserves 4-5 stars. They’ve done way too much to make it all fancy, that it makes the app work so slowly, when navigating between the different functions, especially when it first starts up. Also, annoying that certain deals are scan only, mobile only, deliver only...a deal is a deal. Why should it matter if we use it on the app, at the restaurant, or delivery? And stop the restrictions on using one deal for a certain amount of time!!! If I wanna use a deal, and get back to the end of the line to use another deal, I should be able to do so like the app allowed you to do originally! The new updates have not made anything better, but instead made it more buggy. I’ve never had to keep logging back into my account before, but now it seems like the app can’t remember my login, even if I had already logged in 10 minutes prior, which is very annoying when you’re already in line and waiting for the now slow app to load up and then show the deals, with people waiting behind you. There should be a face/finger ID or stay logged in option. And I agree with another user, if I make an order from my phone and want a friend/family member pick it up, there should be a way to do that. If a super basic Little Caesar’s App can do that, then why can’t this one?!!!",ScalTrojan96,,2,"Used to be great, but now sooooo slooow and very buggy",McDonalds
11,2020-05-20 16:16:36,False,"Overall I enjoyed the app where I could customized my order specifically how I wanted it and could clearly see the price increase for each option - who wouldn’t more pickles for free or a extra slice of cheese for 30 cents.  Also there are daily app exclusive deals and coupons like buy one get one that are great and makes ordering tempting.  However; the issue and an app killer for me is the payment system.   Last 3 trips I ordered and set up for curbside delivery.  A few minutes latter the app shows there’s been an error and I need to “go inside to see the cashier”, so in these social distancing days that means going through the drive through.  When you pull up they can see your order but they say the Payment is still pending.  Each time I check the app and it gives me no option to retry payment or other options.  So i tell them at the window to cancel the order and end up leaving with no food.   I have now discovered that the charge later went through and still showed up on my credit card statement.  So now I have wasted time on trips to the restaurant, no food, and yet still get charged.  Now I have to spend more time on phone with credit card disputing the charges.  I will no longer use this faulty app.  My advise is to save your time and money and shop elsewhere, unless you wanna go through the drive through and pay double the app price.",stupidity CIV,"{'id': 15473664, 'body': ""Hey there. We're sorry you're having difficulties with your payment. Please provide our Mobile App team with more info at https://www.mcdonalds.com/us/en-us/contact-us/mobile-app-questions.html, so we can further assist you."", 'modified': '2020-05-21T16:56:25Z'}",1,Nice exclusive deals but Payment Failures kill it,McDonalds
12,2019-01-08 22:48:40,False,"I have had the McDonald’s app since the beginning and always been an advocate and even encouraged my friends to get it. The thing is I don’t eat anything at McDonald’s besides fries and salads items, occasionally I may get a dessert or chicken item. In the beginning I was really able to take advantage of the $1 fry deals and the $3 off $10 or $1 off $7. As of recently, about 2 months, those deals are no longer there so I really no longer have anything to gain which is quite disappointing because I do love the app and have been such a fan. I just purchased some items that would have been $4 less had I still had my regular deals. If these new changes to the app will be permanent I only wish McDonald’s would consider deals that are frequented by consumers so that they can be tailored and continue to be taken advantage of. Also consider dietary needs and restrictions I used to have 10-20 deal to select from now I have 3-7 that I know I will not use. For example, I have a free any size soft beverage deal in my app right now, I can’t drink soda so I have no use for such a coupon. I have a $1 off a quarter pounder or Big Mac, also something I can’t have so it will go to waste. Then I have 2 others for a total of 4 deals that I cannot even take advantage of. Disappointing, especially because I know how great it used to be.",A user you're about to lose,,3,Used to be better,McDonalds
13,2020-05-15 23:36:52,False,"I wasted time setting up an accout. I wasted time trying to set up an order. It goes as far as letting you fill out all your info, but won’t let you enter a card to pay for it. I tried 2 different cards, but the ‘save’ button stays grayed out. I tried placing an order which it allowed me to do. But again, I couldn’t pay, as it wouldn’t allow me to save the card info. I hit ‘place order’ figuring I’d just pay cash when I got there. The app said the order was placed. Gave me an order # and all, so I figured everything was good to go. It (the app) said they would start the order when I got there and hit ‘Check In’. The only thing that came close to ‘check In’ was a button that said ‘I’m Already Here’. I pulled in to the parking lot and hit that button cuz nothing changed and it was the only option. Well... Of course the app is now saying It doesn’t have my order or maybe I’m not close enough OR talk to a crew member. I ended up having to go inside and place a whole new order which I was trying to avoid! Then it STILL took forever for these people to understand what I’m trying to explain what happened! It was so aggravating, the whole thing! Then I have to put up with their condescending attitudes... Unbelievable...
And of course there’s no one around to help figure out the problem. So that’s the last time I’ll be going to McDonald’s any more. Who needs the aggravation?",WayneD420,"{'id': 15359491, 'body': ""We're sorry about your experience with Mobile Order & Pay, Wayne! Please provide our Mobile App team with more info at https://www.mcdonalds.com/us/en-us/contact-us/mobile-app-questions.html, so we can look into this further."", 'modified': '2020-05-16T16:08:27Z'}",1,Waste Of Time,McDonalds
14,2019-08-28 17:30:22,False,"This review is long overdue and after not being able to use the only good coupon I have got on this app in months because my McDonald’s that I always go to is no longer a “participating location,” I finally feel the need to write this review. This app used to be SPECTACULAR and there were always plenty of coupons I could use daily and they were very good deals too! I was able to purchase food for myself and my family without breaking the bank too much. Then randomly one day they changed the entire app and removed all of the good coupons. Now there is one coupon daily (If I’m lucky two) and it can hardly be considered a “deal” as I’m saving like 30¢ rather than the $3-4 I used to save from a coupon. You can also get a coupon from this Plinko style game that you sometimes have to play a few times to even land something in the bag. From my experience you can play until you win however the $1 off coupon you receive after is normally never for anything I want so it’s hardly worth it. Not to mention it seems you have to use this coupon while ordering through the app and sitting in the parking lot, which is not my preferred way to eat at McDonald’s. They should bring this app back to its former glory so that it may have a purpose again because it’s current state is trash and I don’t even feel the need to open it as I wait in line at McDonald’s since I already know there will be no coupons worthwhile.",FlyingDog31,,1,No Good Deals,McDonalds
15,2021-01-03 17:13:28,False,"At about 10:15am I was thinking to go to McDonald's for breakfast.  There is always the question of when breakfast is no longer served - app said 11am for my McDonald's.  Great!  I have more than enough time.  So I get there at about 10:25 and try to place my order via the app.  I get an error that certain items are no longer available and those are removed.  Darn, I'll need to select something else.  I go back to the menu and it's the same menu with all the items available.  Try to order again, unavailable.  I kill the app and reopen it to try to ""refresh"" the available items.  Same menu, and trying to order many of these items still gave me the same ""unavailable"" message.  At this point I am very frustrated and go to the nearby Starbucks instead.

I assume what happened is that perhaps there is a more limited breakfast menu from 10:30-11:00 even though 1) it said breakfast until 11, and 2) the app was giving me the same full breakfast menu even at 10:35.  What's frustrating is that the app has the ability to understand the item availability since it errored during checkout, but apparently this information is not incorporated when ""building"" the menu that is shown.  So it's basically trial-and-error to find something available.  Perhaps the app should lock down from 10-11am daily if it's not possible to serve an accurate menu during that time.",Elderly Gentleman,"{'id': 20223173, 'body': 'We always want your Mobile Ordering to be awesome. Please provide our Mobile App team with more info at https://www.mcdonalds.com/us/en-us/contact-us/mobile-app-questions.html\r\n', 'modified': '2021-01-06T17:45:04Z'}",1,10-11am is a disaster,McDonalds
